	SentenceId	Clause Text	Codes	ExperimentValues	Paragraph	Headings	FloatingBox?	Discourse Type	Offset_Begin	Offset_End	fig_spans
326	s212	"Pex13p could be involved in targeting , or"	[]		p59	Results	FALSE	hypothesis	31870	31911	
327	s212	it could be required for binding or retention of Pex14p at the peroxisome .	[]		p59	Results	FALSE	hypothesis	31912	31986	
328	s213	Binding to the SH3 Domain of Pex13p Is Not Essential for the Peroxisomal Membrane Association of Pex14p	[header-1]		title60	Results	FALSE	implication	31987	32090	
329	s214	To clarify whether binding of Pex14p to the SH3 domain is a prerequisite for the peroxisomal targeting of Pex14p	[]		p61	Results	FALSE	goal	32091	32203	
330	s214	we analyzed the subcellular localization of Pex14p under conditions in which this interaction is blocked .	[]		p61	Results	FALSE	method	32204	32310	
331	s215	A proline-rich sequence	[]		p61	Results	FALSE	fact	32311	32334	
332	s215	"which corresponds to a type II SH3 domain binding motif is present within the primary sequence of Pex14p ( Albertini et al. , 1997 ; Brocard et al. , 1997 ) ."	[exLink]		p61	Results	FALSE	fact	32335	32487	
333	s216	We substituted Pro87 and Pro90 of this putative binding motif ( PPTLPHRDW ) by two alanines ( PATLAHRDW ) .	[]		p61	Results	FALSE	method	32488	32590	
334	s217	"Remarkably , the mutated Pex14pAXXA still complemented the peroxisome biogenesis defect of pex14Delta cells ( data not shown ) ."	[]		p61	Results	FALSE	result	32591	32715	
335	s218	We also introduced an E320K mutation in the reverse transcriptase loop ( RT loop ) of the SH3 domain of Pex13p .	[]		p61	Results	FALSE	method	32716	32825	
336	s219	This mutation has been reported	[]		p61	Results	FALSE	result	32826	32857	
337	s219	"to result in the inactivation of Pex13p function ( Elgersma et al. , 1996 ) ."	[exLink]		p61	Results	FALSE	result	32858	32931	
338	s220	"As shown in Fig. 8 , the mutated Pex14pAXXA had lost the ability to bind Pex13p in the yeast two-hybrid system"	[inLink]	f8	p61	Results	FALSE	result	32932	33041	f8
339	s220	"while binding to Pex5p , Pex7p , and oligomerization of the protein was unchanged ."	[]		p61	Results	FALSE	result	33042	33122	f8
340	s221	Also the E320K mutation of Pex13p abolished the two-hybrid interaction of the SH3 domain of Pex13p with Pex14p ( Fig. 8 ) .	[inLink]	f8	p61	Results	FALSE	result	33123	33243	f8
341	s222	These results suggest	[]		p61	Results	FALSE	implication	33244	33265	f8
342	s222	"that strong interactions between Pex14p and the SH3 domain of Pex13p are dependent on the PXXP motif within Pex14p , as well as on the RT loop of the SH3 domain of Pex13p ."	[]		p61	Results	FALSE	implication	33266	33436	f8
343	s223	"Next , we analyzed the Pex14pAXXA ( Fig. 9 A ) association with peroxisomal membrane ghosts of pex14Delta/pex17Delta double mutants"	[inLink]	f9a	p62	Results	FALSE	method	33437	33565	f9a
344	s223	which were predicted to contain peroxisomal membrane ghosts even upon complementation of the pex14Delta mutation .	[]		p62	Results	FALSE	method	33566	33679	f9a
345	s224	"In addition , we analyzed"	[]		p62	Results	FALSE	method	33680	33704	f9a
346	s224	whether peroxisomal membrane ghosts that harbor mutated Pex13pE320K still contain Pex14p .	[]		p62	Results	FALSE	hypothesis	33705	33794	f9a
347	s225	"The subcellular localization of Pex14p , Pex14pAXXA , and peroxisomal membrane markers was analyzed by double immunofluorescence microscopy and flotation analysis ."	[]		p62	Results	FALSE	method	33795	33956	f9a
348	s226	"Colocalization was observed for HA-Pex11p and Pex14pAXXA in pex14Delta cells , as well as for HA-Pex11p and Pex14p in pex13Delta cells expressing Pex13pE320K , indicative of peroxisomal membrane association of these proteins ( Fig. 9 A ) ."	[inLink]	f9a	p62	Results	FALSE	result	33957	34191	f9a
349	s227	These results were corroborated by flotation analysis	[]		p62	Results	FALSE	method	34192	34245	f9b|f9a
350	s227	"which revealed that Pex14pAXXA was associated with the fraction containing the peroxisomal membrane ghosts of pex14Delta/pex17Delta , as were Pex14p in pex13Delta/pex17Delta cells expressing Pex13pE320K ( Fig. 9 B ) ."	[inLink]	f9b	p62	Results	FALSE	result	34246	34459	f9b|f9a
351	s228	These observations suggest	[]		p62	Results	FALSE	implication	34460	34486	f9b
352	s228	that Pex14p is associated with peroxisomes and peroxisomal membrane ghosts independent of interaction between the proline-rich motif of Pex14p and the RT loop in the SH3 domain of Pex13p .	[]		p62	Results	FALSE	implication	34487	34674	f9b
353	s229	"Interestingly , the fractionation of pex13Delta/ pex17Delta [ PEX13E320K ] shows"	[]		p62	Results	FALSE	method	34675	34751	f9b
354	s229	"that , although the RT loop of the SH3 domain of Pex13p is not absolutely required for the targeting of Pex14p to the membrane of peroxisomal ghosts , it appears to enhance or stabilize the targeting , as only Pex14p trails through the gradients of this mutant strain ( Fig. 9 B ) ."	[inLink]	f9b	p62	Results	FALSE	implication	34752	35028	f9b
355	s230	Discussion	[header-0]		title63	Discussion	FALSE	none	35029	35039	
356	s231	"The peroxisomal membrane protein Pex14p has been reported to bind both the PTS1 and the PTS2 receptor ,"	[]		p64	Discussion	FALSE	result	35040	35142	
357	s231	which led Albertini et al. ( 1997 ) to the conclusion that Pex14p may represent the point of convergence of the PTS1 - and PTS2-dependent protein import pathways at the peroxisomal membrane .	[exLink]		p64	Discussion	FALSE	implication	35143	35330	
358	s232	"Here , we report"	[]		p64	Discussion	FALSE	none	35331	35346	
359	s232	that Pex13p is also involved in both the PTS1 - and PTS2-dependent protein import into peroxisomes .	[]		p64	Discussion	FALSE	fact	35347	35445	
360	s233	Pex13p interacts directly or indirectly with the PTS2 receptor Pex7p and	[]		p64	Discussion	FALSE	fact	35446	35518	
361	s233	overexpression of Pex13p suppresses the protein import defect caused by a functionally impaired epitope-tagged Pex7p .	[]		p64	Discussion	FALSE	fact	35519	35636	
362	s234	Pex13p is also shown to be required for the peroxisomal association of Pex14p ;	[]		p64	Discussion	FALSE	implication	35637	35715	
363	s234	"however , evidence is provided that the SH3 domain of Pex13p may not represent the only binding site for Pex14p at the peroxisomal membrane ."	[]		p64	Discussion	FALSE	implication	35716	35855	
364	s235	Involvement of Pex13p in Targeting of Pex14p to the Peroxisomal Membrane	[header-1]		title65	Discussion	FALSE	none	35856	35928	
365	s236	The SH3 domain of Pex13p has been reported	[]		p66	Discussion	FALSE	result	35929	35971	
366	s236	"to interact with the PTS1 receptor Pex5p and with Pex14p ( Elgersma et al. , 1996 ; Erdmann and Blobel , 1996 ; Gould et al. , 1996 ; Albertini et al. , 1997 ; Fransen et al. , 1998 ; Fig. 8 ) ."	"[inLink, exLink]"		p66	Discussion	FALSE	result	35972	36153	
367	s237	"A mutation in the RT loop of the SH3 domain of Pex13p , as well as a mutation of a putative class II SH3 ligand"	[]		p66	Discussion	FALSE	result	36154	36264	
368	s237	"motif of Pex14p abolished the two-hybrid interaction of both proteins ( Fig. 8 ) , supporting the notion of a typical SH3 domain-ligand interaction between Pex13p and Pex14p ."	[inLink]	f8	p66	Discussion	FALSE	result	36265	36436	
369	s238	"Interestingly ,"	[]		p66	Discussion	FALSE	result	36437	36451	
370	s238	"although the E320K mutation of the RT loop of the SH3 domain of Pex13p abolishes its two-hybrid interaction with Pex14p , the mutated SH3 domain still interacts with Pex5p ( Fig. 8 B ) ."	[inLink]	f8b	p66	Discussion	FALSE	result	36452	36634	
371	s239	"Accordingly , we conclude"	[]		p66	Discussion	FALSE	implication	36635	36659	
372	s239	that there are distinct binding sites for both Pex5p and Pex14p within this domain or adjacent regions contained within the construct used for the assay .	[]		p66	Discussion	FALSE	implication	36660	36813	
373	s240	"Remarkably , neither the E320K mutation of the SH3 domain of Pex13p nor the mutation of the proline-rich motif of Pex14p prevented the peroxisomal localization of Pex14p ( Fig. 9 ) ."	[inLink]	f9	p67	Discussion	FALSE	result	36814	36992	
374	s241	This observation suggests	[]		p67	Discussion	FALSE	implication	36993	37018	
375	s241	that the binding of Pex14p to the SH3 domain of Pex13p is not absolutely required for the targeting and binding of Pex14p to peroxisomes .	[]		p67	Discussion	FALSE	implication	37019	37156	
376	s242	Why then does the absence of Pex13p lead to the mistargeting of Pex14p ( Fig. 7 ) ?	[inLink]	f7	p67	Discussion	FALSE	problem	37157	37237	
377	s243	One possibility is	[]		p67	Discussion	FALSE	hypothesis	37238	37256	
378	s243	"that Pex13p is a component of a protein complex at the peroxisomal membrane that may disintegrate in the absence of the entire protein , but remains stable without the SH3-dependent interaction between Pex13p and Pex14p ."	[]		p67	Discussion	FALSE	hypothesis	37257	37476	
379	s244	"Association of Pex14p with the complex may not require a direct interaction with Pex13p , but may be mediated by other components of the complex ."	[]		p67	Discussion	FALSE	hypothesis	37477	37621	
380	s245	The simplest explanation for our observations on the Pex13p/Pex14p interaction is the existence of an as yet unrecognized binding partner for Pex13p	[]		p67	Discussion	FALSE	implication	37622	37770	
381	s245	that may also provide the binding site for Pex14p at the peroxisomal membrane .	[]		p67	Discussion	FALSE	hypothesis	37771	37849	
382	s246	"This missing link , however , is not Pex17p ."	[]		p67	Discussion	FALSE	implication	37850	37892	
383	s247	"It is true that Pex17p is another binding partner of Pex14p , but"	[]		p67	Discussion	FALSE	fact	37893	37957	
384	s247	"our data suggest that Pex17p is not required for association of the Pex13p/ Pex14p/Pex5p/Pex7p complex , as all these components can efficiently coprecipitate in the absence of Pex17p ( Fig. 3 ) ."	[inLink]	f3	p67	Discussion	FALSE	implication	37958	38150	
385	s248	"Moreover , we found no Pex17p in a precipitate from pex14Delta cells"	[]		p67	Discussion	FALSE	result	38151	38218	
386	s248	"that still contains Pex13p and Pex7p ( Fig. 3 ) , leading to two conclusions ."	[inLink]	f3	p67	Discussion	FALSE	result	38219	38293	
387	s249	"First ,"	[]		p67	Discussion	FALSE	none	38294	38300	
388	s249	"a subcomplex of Pex13p and Pex7p can form in the absence of Pex14p and Pex17p , and second , Pex14p is required for the association of Pex17p with the complex ."	[]		p67	Discussion	FALSE	implication	38301	38458	
389	s250	The latter may be explained by the assumption	[]		p67	Discussion	FALSE	implication	38459	38504	
390	s250	that Pex17p is bound to the complex via Pex14p .	[]		p67	Discussion	FALSE	implication	38505	38552	
391	s251	Pex7p/Pex13p Interaction	[header-1]		title68	Discussion	FALSE	none	38553	38577	
392	s252	"The amount of Pex7p in the membrane sediment of pex14Delta cells is significantly lower than in wild-type or pex13Delta cells ( Fig. 2 ) , suggesting"	[inLink]	f2	p69	Discussion	FALSE	result	38578	38724	
393	s252	that Pex14p may contribute to the majority of the total binding capacity of the peroxisomal membrane for the PTS2 receptor .	[]		p69	Discussion	FALSE	implication	38725	38848	
394	s253	"However , a significant amount of Pex7p was sedimented in the absence of Pex14p ( Fig. 2 , lane pex14Delta ) ."	[inLink]	f2	p69	Discussion	FALSE	result	38849	38954	
395	s254	"Interestingly , in cells lacking both Pex13p and Pex14p , no Pex7p was found in the membrane pellet ,"	[]		p69	Discussion	FALSE	result	38955	39053	
396	s254	which suggests that Pex13p contributed to the remaining Pex7p associated with peroxisomal membranes of pex14Delta cells ( data not shown ) .	[]		p69	Discussion	FALSE	implication	39054	39191	
397	s255	"This result , however , has"	[]		p69	Discussion	FALSE	none	39192	39217	
398	s255	"to be interpreted with care since the double deletion of PEX13 and PEX14 did result in a significant decrease in immunologically detectable Pex7p ( Girzalsky , W. , and R. Erdmann , unpublished observations ) ."	[]		p69	Discussion	FALSE	result	39218	39422	
399	s256	The observations	[]		p70	Discussion	FALSE	result	39423	39439	
400	s256	that Pex13p and Pex7p interact in the two-hybrid system and can be efficiently coimmunoprecipitated indicate that the proteins interact in vivo ( Figs. 3 and 4 ) .	[inLink]	f4	p70	Discussion	FALSE	implication	39440	39600	
401	s257	Whether Pex13p directly binds	[]		p70	Discussion	FALSE	problem	39601	39630	
402	s257	Pex7p remains to be shown .	[]		p70	Discussion	FALSE	problem	39631	39657	
403	s258	Attempts	[]		p70	Discussion	FALSE	none	39658	39666	
404	s258	to demonstrate direct binding of the proteins by coimmunoprecipitation of in vitro translated proteins were unsuccessful ( data not shown ) .	[]		p70	Discussion	FALSE	result	39667	39805	
405	s259	Our data do not exclude the existence of a bridging protein which would directly interact with both Pex13p and Pex7p	[]		p70	Discussion	FALSE	hypothesis	39806	39922	
406	s259	a requirement fulfilled by Pex14p .	[]		p70	Discussion	FALSE	hypothesis	39923	39958	
407	s260	"However , two observations indicate"	[]		p70	Discussion	FALSE	implication	39959	39993	
408	s260	that the hypothetical bridging protein is not one of the known binding partners for Pex13p .	[]		p70	Discussion	FALSE	implication	39994	40085	
409	s261	"First , the Pex7p/Pex13p interaction is also observed in the absence of these proteins ( Figs. 3 and 4 ) , and"	[inLink]	f4	p70	Discussion	FALSE	result	40086	40192	
410	s261	"second , the COOH-terminal SH3 domain alone is sufficient for the Pex13p/ Pex14p and Pex13p/Pex5p two-hybrid interaction , but not for the interaction of Pex13p with Pex7p ( Erdmann and Blobel , 1996 ) ."	[exLink]		p70	Discussion	FALSE	result	40193	40390	
411	s262	A direct interaction of Pex13p and Pex7p is further suggested by the genetic suppression of the defect caused by a functionally compromised HA-tagged Pex7p by overexpression of Pex13p ( Fig. 5 ) .	[inLink]	f5	p70	Discussion	FALSE	implication	40391	40584	
412	s263	As discussed above	[]		p71	Discussion	FALSE	none	40585	40603	
413	s263	a Pex5p/Pex7p two-hybrid interaction is not observed in pex14Delta ( Fig. 1 ) .	[inLink]	f1	p71	Discussion	FALSE	result	40604	40681	
414	s264	"At first , this observation seems rather surprising ,"	[]		p71	Discussion	FALSE	implication	40682	40733	
415	s264	since both Pex5p and Pex7p independently interact with Pex13p in the two-hybrid system ( Fig. 4 ) .	[inLink]	f4	p71	Discussion	FALSE	result	40734	40830	
416	s265	One could imagine	[]		p71	Discussion	FALSE	hypothesis	40831	40848	
417	s265	that Pex13p may serve as a bridging molecule between the import receptors to mediate an indirect binding which could have emerged in the two-hybrid system .	[]		p71	Discussion	FALSE	hypothesis	40849	41004	
418	s266	"However , the amount of Pex5p simultaneously associated with the Pex7p-Pex13p complex may be too low"	[]		p71	Discussion	FALSE	hypothesis	41005	41104	
419	s266	to give a positive response .	[]		p71	Discussion	FALSE	hypothesis	41105	41133	
420	s267	"In support of this assumption , the amount of Pex5p coimmunoprecipitating with Pex7p in the absence of Pex14p is extremely reduced , despite the presence of significant amounts of Pex13p ( Fig. 3 , lane pex14Delta ) ."	[inLink]	f3	p71	Discussion	FALSE	result	41134	41345	
421	s268	Perhaps Pex13p does not usually associate simultaneously with both of the import receptors	[]		p71	Discussion	FALSE	hypothesis	41346	41436	
422	s268	or association is transient .	[]		p71	Discussion	FALSE	hypothesis	41437	41466	
423	s269	"The domain of Pex13 that interacts with Pex7p , as well as the side of the peroxisomal membrane"	[]		p72	Discussion	FALSE	problem	41467	41561	
424	s269	"where the interaction occurs , remains unknown ."	[]		p72	Discussion	FALSE	problem	41562	41608	
425	s270	"Furthermore , the intracellular localization of Pex7p in yeast is still a matter of debate ."	[]		p72	Discussion	FALSE	problem	41609	41699	
426	s271	One group has reported	[]		p72	Discussion	FALSE	result	41700	41722	
427	s271	"that the protein is exclusively localized in the peroxisomal lumen ( Zhang and Lazarow , 1995 , 1996 ) , whereas others found the protein to be predominantly localized in the cytosol with a small amount associated with the peroxisomal membrane ( Marzioch et al. , 1994 ; Rehling et al. , 1996 ) ."	[exLink]		p72	Discussion	FALSE	result	41723	42008	
428	s272	"Because the SH3 domain alone does not mediate the interaction with Pex7p , we suggest"	[]		p72	Discussion	FALSE	fact	42009	42093	
429	s272	that regions NH2-terminal of the SH3 domain may be required for the interaction or contribute to the correct conformation of the binding site .	[]		p72	Discussion	FALSE	hypothesis	42094	42236	
430	s273	"Previously , the COOH-terminal SH3 domain has been reported to face the cytosol ( Elgersma et al. , 1996 ; Gould et al. , 1996 ) , and"	[exLink]		p72	Discussion	FALSE	result	42237	42364	
431	s273	"we found that both the NH2 terminus and the COOH terminus of Pex13p are exposed to the cytosol ( Fig. 6 ) , suggesting that the protein traverses the membrane with an even number of membrane spans ."	[inLink]	f6	p72	Discussion	FALSE	result	42365	42559	
432	s274	"In this respect , it is interesting"	[]		p72	Discussion	FALSE	implication	42560	42594	
433	s274	"to note that two regions which would fulfill the requirement for alpha-helical transmembrane segments are present in Pex13p ( Elgersma et al. , 1996 ) ."	[exLink]		p72	Discussion	FALSE	fact	42595	42743	
434	s275	The interaction of Pex13p with Pex7p has far	[]		p73	Discussion	FALSE	problem	42744	42788	
435	s275	reaching implications for our understanding of protein import into the peroxisomal matrix .	[]		p73	Discussion	FALSE	problem	42789	42879	
436	s276	Why are there several binding sites for the import receptors at the peroxisomal membrane ?	[]		p73	Discussion	FALSE	problem	42880	42969	
437	s277	One hypothesis suggests	[]		p73	Discussion	FALSE	hypothesis	42970	42993	
438	s277	"that the multiple interactions reflect the existence of an import cascade in which the cargo-loaded import receptors are transferred from one component of the import complex to the next ( Erdmann et al. , 1997 ) ."	[exLink]		p73	Discussion	FALSE	hypothesis	42994	43203	
439	s278	Our confirmation that at least two peroxisomal membrane proteins bind the receptors raises concerns	[]		p73	Discussion	FALSE	fact	43204	43303	
440	s278	about which functions as the docking protein for each of the import pathways .	[]		p73	Discussion	FALSE	problem	43304	43381	
441	s279	"Experimental evidence that Pex13p may be the docking protein for the PTS1 receptor has been provided ( Gould et al. , 1996 ) , but"	[exLink]		p73	Discussion	FALSE	result	43382	43508	
442	s279	the unsolved questions stress the need for reliable in vitro systems to study the order of interactions during the process of peroxisomal protein import .	[]		p73	Discussion	FALSE	problem	43509	43662	