	SentenceId	Clause Text	Codes	ExperimentValues	Paragraph	Headings	FloatingBox?	Discourse Type	Offset_Begin	Offset_End	fig_spans
162	s113	Rabbit polyclonal anti-Pex11p antibodies were raised against a synthetic peptide ( KAKSQSQGDEHEDHK ) corresponding to amino acids 162-176 generated by Eurogentec .	[]		p34	Materials and Methods	FALSE	method	16334	16494	
163	s114	"Antithiolase ( Fox3p ; Erdmann and Kunau , 1994 ) , anti-Pcs60p ( Blobel and Erdmann , 1996 ) , anti-Pex3p ( Hohfeld et al. , 1991 ) , anti-Pex5p ( Albertini et al. , 1997 ) , anti-Pex14p ( Albertini et al. , 1997 ) , anti-Pex17p ( Huhse et al. , 1998 ) , and anti-fructose 1,6 bisphosphatase ( anti-Fbp1p ; Bigl and Escherich , 1994 ) have been described previously ."	[exLink]		p35	Materials and Methods	FALSE	method	16495	16833	
164	s115	Anti-rabbit or anti-mouse IgG-coupled HRP ( Nycomed Amersham ) was used as a secondary antibody	[]		p35	Materials and Methods	FALSE	method	16834	16927	
165	s115	and blots were developed using the ECL-system ( Nycomed Amersham ) .	[]		p35	Materials and Methods	FALSE	method	16928	16994	
166	s116	"Western blot analyses were performed according to standard protocols ( Harlow and Lane , 1988 ) ."	[exLink]		p35	Materials and Methods	FALSE	method	16995	17088	
167	s117	Coimmunoprecipitation experiments were performed	[]		p36	Materials and Methods	FALSE	method	17089	17137	
168	s117	"as described in Rehling et al. ( 1996 ) with the exception of omitting the 35,000 g sedimentation step ."	[exLink]		p36	Materials and Methods	FALSE	method	17138	17239	
169	s118	Immunofluorescence Microscopy	[header-1]		title37	Materials and Methods	FALSE	method	17240	17269	
170	s119	"Immunofluorescence microscopy was performed according to the procedure of Rout and Kilmartin ( 1990 ) , with modifications previously described in Erdmann ( 1994 ) ."	[exLink]		p38	Materials and Methods	FALSE	method	17270	17429	
171	s120	"Rabbit antisera against thiolase were used at dilutions of 1:3 ,000 ."	[]		p38	Materials and Methods	FALSE	method	17430	17497	
172	s121	"For detection , 6 mug/ml solution of CY3-conjugated donkey anti-rabbit ( Jackson ImmunoResearch Laboratories ) was used ."	[]		p38	Materials and Methods	FALSE	method	17498	17615	
173	s122	"HA-tagged Pex11p was detected with monoclonal 12CA5 antiserum ( BAbCO ; dilution of 1:1 ,000 ) ."	[]		p38	Materials and Methods	FALSE	method	17616	17707	
174	s123	Membrane Sedimentation	[header-1]		title39	Materials and Methods	FALSE	none	17708	17730	
175	s124	"Yeast cells were grown on 0.3 % SD medium to late log phase and subsequently for 15 h in YNOD ( 0.1 % dextrose , 0.1 % oleic acid , 0.05 % Tween 40 , 0.1 % yeast extract , and 0.67 % yeast nitrogen base ) ."	[]		p40	Materials and Methods	FALSE	method	17731	17924	
176	s125	Cells were washed with dH2O and	[]		p40	Materials and Methods	FALSE	method	17925	17956	
177	s125	1 g was used per sedimentation .	[]		p40	Materials and Methods	FALSE	method	17957	17988	
178	s126	"3 ml of buffer A ( 50 mM Tris-HCl , pH 7.5 , 50 mM NaCl ) , protease inhibitors ( 0.02 % PMSF [ Serva ] , 15 mug/ml bestatin , 1.5 mug/ml pepstatin , 1 mug/ml leupeptin , 0.1 mug/ ml chymostatin [ Boehringer Mannheim ] , 0.21 mg/ml NaF ) , and 3 g glass beads ( 0.5 mm ) were added to the cells ."	[]		p40	Materials and Methods	FALSE	method	17989	18264	
179	s127	Breakage was achieved by	[]		p40	Materials and Methods	FALSE	method	18265	18289	
180	s127	"vortexing for 4 min ( 8 x 30 s , with breaks > =30 s on ice ; Lamb et al. , 1994 ) ."	[exLink]		p40	Materials and Methods	FALSE	result	18290	18367	
181	s128	"Samples were filtered through cotton wool , and"	[]		p40	Materials and Methods	FALSE	method	18368	18414	
182	s128	"the filtrate was transferred to Corex tubes and centrifuged at 1,000 g for 30 min ."	[]		p40	Materials and Methods	FALSE	method	18415	18497	
183	s129	"Supernatants were normalized for protein and volume , and"	[]		p40	Materials and Methods	FALSE	method	18498	18554	
184	s129	"membranes were sedimented at 200,000 g for 30 min ( Sorvall AH650 , 40,850 rpm ) through a cushion of 0.25 M sucrose in buffer A. The resulting pellet was resuspended in buffer A plus protease inhibitors corresponding to the volume of the supernatant ."	[]		p40	Materials and Methods	FALSE	method	18555	18803	
185	s130	Aliquots of the samples were analyzed by SDS-PAGE .	[]		p40	Materials and Methods	FALSE	method	18804	18854	
186	s131	Results	[header-0]		title41	Results	FALSE	none	18855	18862	
187	s132	Interaction of Pex7p with Pex5p Depends on the Presence of Pex14p	[header-1]		title42	Results	FALSE	implication	18863	18928	
188	s133	It has been reported	[]		p43	Results	FALSE	fact	18929	18949	
189	s133	"that the import receptors Pex5p and Pex7p interact with each other in the yeast two-hybrid system , which opened the possibility that both proteins may form a heteromeric cytosolic signal recognition complex ( Rehling et al. , 1996 ) ."	[exLink]		p43	Results	FALSE	hypothesis	18950	19180	
190	s134	"However , the yeast two-hybrid system does not necessarily distinguish between a direct and indirect binding of two S. cerevisiae proteins ,"	[]		p43	Results	FALSE	problem	19181	19319	f1
191	s134	as endogenous proteins may contribute to the observed interaction .	[]		p43	Results	FALSE	problem	19320	19386	f1
192	s135	"As Pex14p can bind both import receptors , we investigated"	[]		p43	Results	FALSE	fact	19387	19444	f1
193	s135	"whether the Pex5p/Pex7p interaction is still observed in a yeast two-hybrid reporter strain deleted for the genomic copy of PEX14 ( Huhse et al. , 1998 ) ."	[exLink]		p43	Results	FALSE	hypothesis	19445	19596	f1
194	s136	"As shown in Fig. 1 , the interaction of the two import receptors strictly depended on the presence of Pex14p which may be required for the activation of either receptor"	[inLink]	f1	p43	Results	FALSE	result	19597	19764	f1
195	s136	or it may function as a bridging molecule between Pex5p and Pex7p .	[]		p43	Results	FALSE	hypothesis	19765	19832	f1
196	s137	Association of Pex7p with Membranes in the Absence of Pex14p	[header-1]		title44	Results	FALSE	none	19833	19893	
197	s138	"Deletion of genes encoding the three components of the docking machinery known to date , Pex13p , Pex14p , or Pex17p , results in an import defect for both PTS1 and PTS2 proteins ."	[]		p45	Results	FALSE	fact	19894	20069	
198	s139	One possible explanation could be a functional overlap of the proteins in PTS1 - and PTS2-dependent protein import into peroxisomes .	[]		p45	Results	FALSE	hypothesis	20070	20201	
199	s140	This prediction prompted	[]		p45	Results	FALSE	goal	20202	20226	
200	s140	us to search for additional Pex7p-binding proteins at the peroxisomal membrane .	[]		p45	Results	FALSE	goal	20227	20306	
201	s141	"We expressed a functional mycPex7p fusion protein ( Marzioch et al. , 1994 ) in wild-type , pex17Delta , pex14Delta , and pex13Delta cells , and determined the localization of the protein by subcellular fractionation studies ."	[exLink]		p45	Results	FALSE	method	20307	20525	
202	s142	"Fractions were analyzed for the presence of mycPex7p and for peroxisomal membrane markers Pex14p and Pex13p , as well as for cytosolic Fbp1p ( Entian et al. , 1988 ) as a control for proper separation ."	[exLink]		p45	Results	FALSE	method	20526	20723	
203	s143	"Pex14p and Pex13p , but not Fbp1p , pelleted ,"	[]		p45	Results	FALSE	method	20724	20767	f2
204	s143	indicating the complete sedimentation of cytosol-free peroxisomal membranes ( Fig. 2 ) .	[inLink]	f2	p45	Results	FALSE	method	20768	20853	f2
205	s144	"As reported previously ( Rehling et al. , 1996 ) , mycPex7p was predominantly found in the soluble fraction in wild-type cells ,"	[exLink]		p45	Results	FALSE	result	20854	20977	
206	s144	while a low but significant amount was detected in the membrane fraction .	[]		p45	Results	FALSE	result	20978	21051	
207	s145	A decrease of mycPex7p in the pellet fraction of pex14Delta cells ( Fig. 2 ) suggests	[inLink]	f2	p45	Results	FALSE	result	21052	21135	f2
208	s145	that the majority of sedimentable Pex7p associates with membranes in a Pex14p-dependent manner .	[]		p45	Results	FALSE	result	21136	21231	f2
209	s146	"However , in pex14Delta cells a significant amount of mycPex7p was detected in the membrane pellet fraction ( Fig. 2 ) ,"	[inLink]	f2	p45	Results	FALSE	result	21232	21348	f2
210	s146	indicating that next to Pex14p additional binding factors for Pex7p exist at the peroxisomal membrane .	[]		p45	Results	FALSE	implication	21349	21451	f2
211	s147	Coimmunoprecipitation of Pex13p and Pex7p in the Absence of Pex14p and Pex5p	[header-1]		title46	Results	FALSE	none	21452	21528	
212	s148	To determine the binding partners of Pex7p	[]		p47	Results	FALSE	goal	21529	21571	
213	s148	"we isolated mycPex7p from wild-type and various pex mutant strains by immunoprecipitation , and immunoblotted for the presence of selected peroxins ."	[]		p47	Results	FALSE	method	21572	21720	
214	s149	"As reported previously , we found Pex5p , Pex13p , Pex14p , and Pex17p associated with mycPex7p"	[]		p47	Results	FALSE	result	21721	21812	
215	s149	"when the receptor was precipitated from wild-type or complemented pex7Delta cells ( Albertini et al. , 1997 ; Huhse et al. , 1998 ) ."	[exLink]		p47	Results	FALSE	result	21813	21940	
216	s150	Comparison of the constituents of the precipitates revealed five interesting observations .	[]		p47	Results	FALSE	result	21941	22031	
217	s151	"First , in pex14Delta and pex5Delta/pex14Delta strains , Pex13p still coimmunoprecipitated with mycPex7p ( Fig. 3 ) ,"	[inLink]	f3	p48	Results	FALSE	result	22032	22144	f3
218	s151	suggesting that Pex13p associates directly or indirectly with Pex7p .	[]		p48	Results	FALSE	implication	22145	22213	f3
219	s152	"Moreover , this result indicated"	[]		p48	Results	FALSE	result	22214	22245	f3
220	s152	that neither Pex14p nor Pex5p is required for the formation of this subcomplex of Pex13p and Pex7p .	[]		p48	Results	FALSE	implication	22246	22345	f3
221	s153	"Second , the amount of Pex5p in the precipitate from pex14Delta cells was drastically reduced ,"	[]		p48	Results	FALSE	result	22346	22439	f3
222	s153	"while the amount in Pex13p remained essentially unchanged ( Fig. 3 , lane pex14Delta ) ."	[inLink]	f3	p48	Results	FALSE	result	22440	22524	f3
223	s154	This result supports the notion	[]		p48	Results	FALSE	implication	22525	22556	f3
224	s154	that the amount of Pex5p bound to Pex13p does not determine the stoichiometry of the Pex13p-Pex7p subcomplex .	[]		p48	Results	FALSE	implication	22557	22666	f3
225	s155	"However , it also suggests"	[]		p48	Results	FALSE	implication	22667	22692	f3
226	s155	that Pex13p may not bind both import receptors equally at the same time .	[]		p48	Results	FALSE	implication	22693	22765	f3
227	s156	"Third , Pex13p , Pex14p , and Pex5p still coimmunoprecipitated with Pex7p in pex17Delta cells ( Fig. 3 , lane pex17Delta ) ."	[inLink]	f3	p48	Results	FALSE	result	22766	22883	f3
228	s157	"Obviously , Pex7p is associated with components of the peroxisomal translocation machinery in the absence of Pex17p ,"	[]		p48	Results	FALSE	result	22884	22999	f3
229	s157	suggesting that the presence of Pex17p is not a prerequisite for docking of Pex7p to the peroxisomal membrane .	[]		p48	Results	FALSE	implication	23000	23110	f3
230	s158	"Fourth , the lack of Pex17p in the coimmunoprecipitate from pex14Delta cells ( Fig. 3 , lane pex14Delta ) , suggests"	[inLink]	f3	p48	Results	FALSE	result	23111	23222	f3
231	s158	"that Pex14p is required for the association of Pex17p with the complex , and is consistent with the assumption that Pex17p binding to the complex may be via Pex14p ."	[]		p48	Results	FALSE	implication	23223	23386	f3
232	s159	"However , this observation must be interpreted with care"	[]		p48	Results	FALSE	problem	23387	23442	f3
233	s159	"since the pex14Delta cells contain much less immunologically detectable Pex17p ( Huhse et al. , 1998 ) ."	[exLink]		p48	Results	FALSE	problem	23443	23543	f3
234	s160	"Finally , the amount of Fox3p"	[]		p48	Results	FALSE	result	23544	23572	f3b|f3
235	s160	"that coimmunoprecipitates with Pex7p drastically increases in mutants with an import defect for PTS2 proteins ( pex17Delta , pex13Delta , pex14Delta , and pex5Delta/pex14Delta ) relative to the strains unaffected in this pathway ( wild-type and pex5Delta ) ."	[]		p48	Results	FALSE	result	23573	23823	f3b|f3
236	s161	"Since the total amount of both proteins is similar in all strains ( Fig. 3 B ) , it seems unlikely"	[inLink]	f3b	p48	Results	FALSE	result	23824	23919	f3b
237	s161	that the observed Pex7p/Fox3p complex has formed in vitro after cell disruption .	[]		p48	Results	FALSE	hypothesis	23920	24000	f3b
238	s162	A simple explanation for this may be	[]		p48	Results	FALSE	implication	24001	24037	f3b
239	s162	that the high cytosolic concentration of thiolase in the import mutants results in greater occupation of the PTS2 receptor .	[]		p48	Results	FALSE	implication	24038	24161	f3b
240	s163	To exclude the possibility of nonspecific coprecipitation of proteins	[]		p49	Results	FALSE	goal	24162	24231	
241	s163	"we checked the precipitates for the presence of peroxisomal membrane proteins Pex11p ( Erdmann and Blobel , 1995 ; Marshall et al. , 1995 ) and Pmp35p ( putative peroxisomal ATP-transporter ; Erdmann , R. , unpublished observations ) ."	[exLink]		p49	Results	FALSE	method	24232	24457	
242	s164	"These proteins were not detected in any of the samples ,"	[]		p49	Results	FALSE	result	24458	24513	
243	s164	indicating the specificity of the observed interactions ( data not shown ) .	[]		p49	Results	FALSE	result	24514	24587	
244	s165	Pex13p Interacts with the PTS2 Receptor Pex7p in the Yeast Two-Hybrid System	[header-1]		title50	Results	FALSE	fact	24588	24664	
245	s166	The observed in vivo association of Pex7p with Pex13p in cells lacking Pex14p and Pex5p encouraged	[]		p51	Results	FALSE	result	24665	24763	
246	s166	us to analyze the interaction of these proteins in more detail .	[]		p51	Results	FALSE	goal	24764	24827	
247	s167	"In previous experiments , only fragments of Pex13p were used to address whether Pex13p binds to Pex7p , and"	[]		p51	Results	FALSE	method	24828	24933	
248	s167	"so far they have not indicated an interaction between these two proteins ( Erdmann and Blobel , 1996 ) ."	[exLink]		p51	Results	FALSE	result	24934	25034	
249	s168	To revisit this possibility	[]		p51	Results	FALSE	goal	25035	25062	f4a
250	s168	we analyzed the interaction of the full length Pex13p with Pex7p in the yeast two-hybrid system .	[]		p51	Results	FALSE	method	25063	25160	f4a
251	s169	The results shown in Fig. 4 A reveal	[inLink]	f4a	p51	Results	FALSE	result	25161	25197	f4a
252	s169	that the full length Pex13p is indeed able to interact with the PTS2-receptor Pex7p .	[]		p51	Results	FALSE	result	25198	25282	f4a
253	s170	The controls included show	[]		p51	Results	FALSE	result	25283	25309	f4a
254	s170	that coexpression of either of the fusion proteins alone did not support transcription activation of the reporter genes .	[]		p51	Results	FALSE	result	25310	25430	f4a
255	s171	To analyze whether the observed Pex13p/Pex7p two-hybrid interaction depends on known binding partners for Pex13p	[]		p52	Results	FALSE	goal	25431	25543	f4a
256	s171	tests were also performed in isogenic pex5Delta and pex14Delta strains ( Fig. 4 A ) .	[inLink]	f4a	p52	Results	FALSE	method	25544	25627	f4a
257	s172	"Furthermore , we analyzed the association of Pex7p with a mutated Pex13pE320K in a pex5Delta mutant ( Fig. 4 B ) ."	[inLink]	f4b	p52	Results	FALSE	method	25628	25738	f4b
258	s173	"Because Pex13pE320K lost the ability to interact with Pex14p in the yeast two-hybrid system ( Fig. 4 B , see also Fig. 8 )"	[inLink]	f8	p52	Results	FALSE	result	25739	25858	f8|f4
259	s173	this experiment was expected to monitor the Pex13p/Pex7p interaction upon simultaneous elimination of the Pex14p and Pex5p influence .	[]		p52	Results	FALSE	hypothesis	25859	25993	f8|f4
260	s174	As shown in Fig. 4	[inLink]	f4	p52	Results	FALSE	result	25994	26012	f4a|f4b|f4
261	s174	these two-hybrid analyses did not reveal an influence of Pex5p or Pex14p on the Pex13p/ Pex7p interaction .	[]		p52	Results	FALSE	result	26013	26120	f4a|f4b|f4
262	s175	No difference was observed independent of	[]		p52	Results	FALSE	result	26121	26162	f4a|f4b|f4
263	s175	"whether the Pex7p/Pex13p interaction was analyzed in wild-type , pex5Delta , or pex14Delta strains ( Fig. 4 A ) , or for the Pex7p/Pex13pE320K interaction in pex5Delta cells ( Fig. 4 B ) ."	[inLink]	f4a|f4b	p52	Results	FALSE	result	26163	26343	f4a|f4b|f4
264	s176	These results indicate	[]		p52	Results	FALSE	implication	26344	26366	f4a|f4b|f3
265	s176	"that neither Pex14p nor Pex5p is required for the in vivo interaction of Pex7p with Pex13p , and therefore are in agreement with results obtained in the coimmunoprecipitation experiment ( Fig. 3 ) ."	[inLink]	f3	p52	Results	FALSE	implication	26367	26561	f4a|f4b|f3
266	s177	"The two-hybrid interaction of the complete Pex13p with Pex14p is only detected by histidine prototrophy ( Fig. 4 B ) ,"	[inLink]	f4b	p53	Results	FALSE	result	26562	26677	f4b
267	s177	indicating that regions NH2-terminal of the SH3 domain of Pex13p may weaken the interaction of these proteins in the two-hybrid system .	[]		p53	Results	FALSE	implication	26678	26813	f4b
268	s178	PEX13 Suppresses a Defect in Pex7p Function	[header-1]		title54	Results	FALSE	implication	26814	26857	f5a
269	s179	Mutant cells lacking Pex7p are characterized by their inability	[]		p55	Results	FALSE	fact	26858	26921	f5a
270	s179	"to grow on oleic acid as the sole carbon source ( Fig. 5 A ) and by mislocalization of peroxisomal thiolase to the cytosol ( Marzioch et al. , 1994 ; Zhang and Lazarow , 1995 ) ."	"[inLink, exLink]"	f5a	p55	Results	FALSE	fact	26922	27092	f5a
271	s180	"Expression of a COOH-terminally HA-tagged Pex7p from the low copy plasmid pRSPEX7-HA3 leads only to a partial complementation of the pex7Delta mutant phenotype ( Zhang and Lazarow , 1995 ) ."	[exLink]		p55	Results	FALSE	result	27093	27279	f5a
272	s181	This is indicated by the inability of the transformants	[]		p55	Results	FALSE	result	27280	27335	f5b|f5a
273	s181	to grow on oleic acid plates ( Fig. 5 A ) and a reduced ability to import Fox3p ( thiolase ) into peroxisomes .	[inLink]	f5a	p55	Results	FALSE	result	27336	27442	f5b|f5a
274	s182	"The latter is evident by the pronounced cytosolic mislocalization of this protein ( Fig. 5 B , panel d ) ."	[inLink]	f5b	p55	Results	FALSE	result	27443	27545	f5b|f5a
275	s183	This mutant phenotype of pex7Delta [ pRSPEX7-HA3 ] was employed	[]		p55	Results	FALSE	goal	27546	27606	f5b|f5a
276	s183	to investigate whether overexpression of Pex7p-binding partners may suppress a defect in Pex7p function .	[]		p55	Results	FALSE	goal	27607	27711	f5b|f5a
277	s184	Cells expressing Pex7p-HA3 were transformed with multicopy plasmids	[]		p55	Results	FALSE	method	27712	27779	f5b|f5a
278	s184	containing either PEX14 or PEX13 under the control of their own promoters .	[]		p55	Results	FALSE	method	27780	27854	f5b|f5a
279	s185	As judged by their growth characteristics on oleic acid medium ( Fig. 5 A ) and by the fluorescence pattern for thiolase ( Fig. 5 B )	[inLink]	f5a|f5b	p55	Results	FALSE	result	27855	27984	f5b|f5a
280	s185	"overexpression of PEX13 , but not PEX14 , rescued the mutant phenotype caused by the defective Pex7p-HA ."	[]		p55	Results	FALSE	result	27985	28088	f5b|f5a
281	s186	"Even though the suppression was not as efficient as complementation with the wild-type PEX7 , this observation demonstrates"	[]		p55	Results	FALSE	result	28089	28211	f5b|f5a
282	s186	"that Pex13p can suppress the mutant phenotype of pex7Delta [ pRSPEX7-HA3 ] , providing genetic evidence for an interaction between Pex7p and Pex13p ."	[]		p55	Results	FALSE	implication	28212	28356	f5b|f5a
283	s187	The NH2 Terminus and the COOH-terminal SH3 Domain of Pex13p Face the Cytosol	[header-1]		title56	Results	FALSE	implication	28357	28433	
284	s188	Pex13p is an integral peroxisomal membrane protein and	[]		p57	Results	FALSE	fact	28434	28488	
285	s188	"the cytosolic orientation of the COOH-terminal SH3 domain was shown previously in human fibroblasts ( Elgersma et al. , 1996 ) and Pichia pastoris ( Gould et al. , 1996 ) ."	[exLink]		p57	Results	FALSE	fact	28489	28654	
286	s189	"However , the COOH-terminal SH3 domain alone is not sufficient"	[]		p57	Results	FALSE	problem	28655	28716	
287	s189	"to interact with Pex7p , suggesting that regions NH2-terminal to the SH3 domain are involved in this association ."	[]		p57	Results	FALSE	problem	28717	28829	
288	s190	To address whether the NH2 terminus of Pex13p is localized to the lumen of peroxisomes or to the cytosol	[]		p57	Results	FALSE	goal	28830	28934	
289	s190	we analyzed the accessibility of an NH2-terminally myc-tagged Pex13p to exogenously added protease K .	[]		p57	Results	FALSE	method	28935	29037	
290	s191	The tag has been shown previously	[]		p57	Results	FALSE	result	29038	29071	
291	s191	"not to affect the function of Pex13p ( Erdmann and Blobel , 1996 ) ."	[exLink]		p57	Results	FALSE	result	29072	29136	
292	s192	"Thus , the topology of the myc-tagged Pex13p is likely"	[]		p57	Results	FALSE	hypothesis	29137	29190	
293	s192	to reflect the in vivo situation for the wild-type protein .	[]		p57	Results	FALSE	hypothesis	29191	29250	
294	s193	As judged by immunoblot analysis	[]		p57	Results	FALSE	result	29251	29283	f6
295	s193	both the NH2-terminal myc-tag as well as the SH3 domain of Pex13p were rapidly degraded by the protease ( Fig. 6 ) .	[inLink]	f6	p57	Results	FALSE	result	29284	29398	f6
296	s194	Intraperoxisomal thiolase remained stable under these conditions and was only degraded in the presence of detergents ( data not shown ) .	[]		p57	Results	FALSE	result	29399	29533	f6
297	s195	"From this data , we conclude"	[]		p57	Results	FALSE	implication	29534	29561	f6
298	s195	that both the NH2 terminus and the COOH-terminal SH3 domain are exposed to the cytosol .	[]		p57	Results	FALSE	implication	29562	29649	f6
299	s196	This result also implicates the presence of an even number of transmembrane spans within Pex13p .	[]		p57	Results	FALSE	implication	29650	29746	f6
300	s197	Pex13p Is Required for Association of Pex14p with Peroxisomal Membranes	[header-1]		title58	Results	FALSE	implication	29747	29818	
301	s198	"Pex13p interacts with Pex14p via its COOH-terminal SH3 domain ( Albertini et al. , 1997 ; Brocard et al. , 1997 )"	[exLink]		p59	Results	FALSE	fact	29819	29927	
302	s198	"however , both proteins can interact with Pex7p independently ."	[]		p59	Results	FALSE	fact	29928	29990	
303	s199	The latter is in agreement with the assumption	[]		p59	Results	FALSE	fact	29991	30037	
304	s199	that Pex13p and Pex14p contribute to distinct docking sites for Pex7p at the peroxisomal membrane .	[]		p59	Results	FALSE	fact	30038	30136	
305	s200	Since	[]		p59	Results	FALSE	problem	30137	30142	
306	s200	"Pex14p is a peripheral membrane protein , two questions arise : How is it associated with the peroxisomal membrane , and Does Pex13p contribute to its localization ?"	[]		p59	Results	FALSE	problem	30143	30304	
307	s201	In an attempt	[]		p59	Results	FALSE	none	30305	30318	f7a
308	s201	"to identify proteins required for the targeting and binding of Pex14p to the peroxisomal membrane , we analyzed the subcellular localization of Pex14p in different pex-mutant cells ( Fig. 7 A ) ."	[inLink]	f7a	p59	Results	FALSE	method	30319	30510	f7a
309	s202	The congruent fluorescence patterns for Pex14p and the peroxisomal membrane marker Pex11p in pex17Delta cells indicate a peroxisomal localization of Pex14p .	[]		p59	Results	FALSE	result	30511	30667	f7a
310	s203	This observation suggests	[]		p59	Results	FALSE	implication	30668	30693	f7a
311	s203	that Pex17p is not required for the targeting of Pex14p to the peroxisomal membrane .	[]		p59	Results	FALSE	implication	30694	30778	f7a
312	s204	"In contrast , no congruent fluorescence patterns were observed in pex13Delta cells ."	[]		p59	Results	FALSE	result	30779	30861	f7a
313	s205	"Since the HA-tagged Pex11p is known to be targeted to peroxisomal membrane ghosts in pex13Delta cells ( Erdmann and Blobel , 1996 )"	[exLink]		p59	Results	FALSE	result	30862	30990	f7a
314	s205	the lack of congruence suggests that the majority of Pex14p is mislocalized .	[]		p59	Results	FALSE	implication	30991	31068	f7a
315	s206	To confirm this result by independent means	[]		p59	Results	FALSE	goal	31069	31112	f7a|f7b
316	s206	"we performed a flotation of wild-type , pex13Delta , and pex17Delta homogenates in sucrose gradients ( Fig. 7 B ) ."	[inLink]	f7b	p59	Results	FALSE	method	31113	31224	f7a|f7b
317	s207	Gradients were designed such	[]		p59	Results	FALSE	method	31225	31253	
318	s207	"that peroxisomal membrane ghosts would float to the upper fractions of the gradient , whereas intact peroxisomes would predominantly remain in the loading zone ."	[]		p59	Results	FALSE	method	31254	31413	
319	s208	"In pex13Delta cells , the peroxisomal membrane markers"	[]		p59	Results	FALSE	result	31414	31467	
320	s208	Pex3p and Pex11p were predominantly found in fractions that correspond to the peroxisomal membrane ghosts .	[]		p59	Results	FALSE	result	31468	31574	
321	s209	"However , Pex14p was not detected in these fractions , but was found"	[]		p59	Results	FALSE	result	31575	31641	
322	s209	to cosegregate with mitochondrial fumarase .	[]		p59	Results	FALSE	result	31642	31685	
323	s210	These data suggest	[]		p59	Results	FALSE	implication	31686	31704	
324	s210	that the peroxisomal membrane ghosts in pex13Delta cells lack Pex14p .	[]		p59	Results	FALSE	implication	31705	31774	
325	s211	"Thus , the presence of Pex13p is a prerequisite for peroxisomal membrane association of Pex14p ."	[]		p59	Results	FALSE	implication	31775	31869	
