	SentenceId	Clause Text	Codes	ExperimentValues	Paragraph	Headings	FloatingBox?	Discourse Type	Offset_Begin	Offset_End	fig_spans
0	s1	Involvement of Pex13p in Pex14p Localization and Peroxisomal Targeting Signal 2-dependent Protein Import into Peroxisomes	[]		-		FALSE	none	127	248	
1	s2	Pex13p is the putative docking protein for peroxisomal targeting signal 1 ( PTS1 ) -dependent protein import into peroxisomes .	[]		p3		FALSE	fact	799	922	
2	s3	Pex14p interacts with both the PTS1 - and PTS2-receptor and may represent the point of convergence of the PTS1 - and PTS2-dependent protein import pathways .	[]		p3		FALSE	fact	923	1077	
3	s4	We report the involvement of Pex13p in peroxisomal import of PTS2-containing proteins .	[]		p3		FALSE	result	1078	1164	
4	s5	"Like Pex14p ,"	[]		p3		FALSE	none	1165	1177	
5	s5	"Pex13p not only interacts with the PTS1-receptor Pex5p , but also with the PTS2-receptor Pex7p ; however , this association may be direct or indirect ."	[]		p3		FALSE	fact	1178	1325	
6	s6	"In support of distinct peroxisomal binding sites for Pex7p , the Pex7p/Pex13p and Pex7p/ Pex14p complexes can form independently. Genetic"	[]		p3		FALSE	hypothesis	1326	1462	
7	s6	evidence for the interaction of Pex7p and Pex13p is provided by the observation that overexpression of Pex13p suppresses a loss of function mutant of Pex7p .	[]		p3		FALSE	result	1463	1619	
8	s7	"Accordingly , we conclude"	[]		p3		FALSE	implication	1620	1644	
9	s7	that Pex7p and Pex13p functionally interact during PTS2-dependent protein import into peroxisomes .	[]		p3		FALSE	implication	1645	1743	
10	s8	NH2-terminal regions of Pex13p are required for its interaction with the PTS2-receptor	[]		p3		FALSE	implication	1744	1830	
11	s8	while the COOH-terminal SH3 domain alone is sufficient to mediate its interaction with the PTS1-receptor .	[]		p3		FALSE	implication	1831	1936	
12	s9	Reinvestigation of the topology revealed both termini of Pex13p	[]		p3		FALSE	result	1937	2000	
13	s9	to be oriented towards the cytosol .	[]		p3		FALSE	result	2001	2036	
14	s10	"We also found Pex13p to be required for peroxisomal association of Pex14p , yet"	[]		p3		FALSE	result	2037	2115	
15	s10	the SH3 domain of Pex13p may not provide the only binding site for Pex14p at the peroxisomal membrane .	[]		p3		FALSE	implication	2116	2218	
16	s11	"Peroxisomal matrix proteins are synthesized on free polyribosomes and imported after translation into preexisting organelles ( Lazarow and Fujiki , 1985 ) ."	[exLink]		p4		FALSE	fact	2267	2419	
17	s12	The presence of two distinct peroxisomal targeting signals ( PTSs ) 1 indicates the involvement of two pathways in the sorting process of peroxisomal matrix proteins .	[]		p4		FALSE	fact	2420	2583	
18	s13	"PTS1 , present in the majority of peroxisomal matrix proteins , comprises the three COOH-terminal amino acids with the sequence SKL or conserved variants"	[]		p4		FALSE	fact	2584	2736	
19	s13	"for review see McNew and Goodman , 1996 ) ."	[exLink]		p4		FALSE	none	2737	2777	
20	s14	"Only one known peroxisomal matrix protein in Saccharomyces cerevisiae , thiolase , targets the peroxisomal lumen by the PTS2 ,"	[]		p4		FALSE	fact	2778	2901	
21	s14	"which is typically localized close to the NH2 terminus of a protein , and consists of a conserved nonapeptide with the consensus sequence RLX5H/QL ( for review see De Hoop and Ab , 1992 ) ."	[exLink]		p4		FALSE	fact	2902	3086	
22	s15	"Recognition of PTS1 and PTS2 targeting signals is performed by the PTS specific import receptors , Pex5p and Pex7p , respectively"	[]		p5		FALSE	fact	3087	3215	
23	s15	"for review see Subramani , 1996 ; Erdmann et al. , 1997 ) ."	[exLink]		p5		FALSE	none	3216	3270	
24	s16	Cells deficient in either protein display partial import deficiencies .	[]		p5		FALSE	fact	3271	3341	
25	s17	"pex5Delta cells correctly localize PTS2 proteins , but are deficient in the targeting of PTS1 proteins ."	[]		p5		FALSE	fact	3342	3444	
26	s18	pex7Delta cells exhibit the reverse phenotype	[]		p5		FALSE	fact	3445	3491	
27	s18	"for review see Elgersma and Tabak , 1996 ) ."	[exLink]		p5		FALSE	fact	3492	3533	
28	s19	The intracellular localization of both targeting signal receptors is still a matter of debate .	[]		p5		FALSE	problem	3534	3628	
29	s20	"A predominantly cytosolic , membrane-bound , and even intraperoxisomal localization have been reported for both receptors"	[]		p5		FALSE	result	3629	3749	
30	s20	"for review see Rachubinski and Subramani , 1995 ) ."	[exLink]		p5		FALSE	result	3750	3798	
31	s21	"An attractive model to reconcile the different localization of the import receptors is the extended shuttle hypothesis ( Dodt and Gould , 1996 ; van der Klei and Veenhuis , 1996 ; Erdmann et al. , 1997 ) ,"	[exLink]		p6		FALSE	hypothesis	3799	3996	
32	s21	"which is a modification of the original hypothesis of shuttling receptors ( Marzioch et al. , 1994 ) ."	[exLink]		p6		FALSE	hypothesis	3997	4095	
33	s22	The extended shuttle suggests	[]		p6		FALSE	hypothesis	4096	4125	
34	s22	"that the import receptors Pex5p and Pex7p bind cargo proteins in the cytosol , dock to specific proteins at the periphery of the peroxisomal membrane , subsequently enter the peroxisome , release their cargo in the lumen of the peroxisome , and shuttle back to the cytoplasm ."	[]		p6		FALSE	hypothesis	4126	4397	
35	s23	"There is no experimental evidence for this model , but"	[]		p6		FALSE	result	4398	4451	
36	s23	"it is consistent with the observation that peroxisomes are able to import both folded and oligomeric proteins ( for review see McNew and Goodman , 1996 ) ."	[exLink]		p6		FALSE	implication	4452	4603	
37	s24	"However , the mechanism of protein translocation across the peroxisomal membrane remains unclear ."	[]		p6		FALSE	problem	4604	4700	
38	s25	These shuttle models predict the existence of	[]		p7		FALSE	hypothesis	4701	4746	
39	s25	docking sites at the peroxisomal membrane for cargo-loaded PTS receptors .	[]		p7		FALSE	hypothesis	4747	4820	
40	s26	"To date , two peroxisomal membrane proteins have been described"	[]		p7		FALSE	result	4821	4883	
41	s26	which display the necessary properties to serve as docking sites for PTS receptors at the organelle .	[]		p7		FALSE	result	4884	4984	
42	s27	"Pex13p , an integral peroxisomal membrane protein , specifically binds by means of its cytosolic SH3 domain to the PTS1 receptor Pex5p ( Elgersma et al. , 1996 ; Erdmann and Blobel , 1996 ; Gould et al. , 1996 ) ."	[exLink]		p7		FALSE	fact	4985	5188	
43	s28	"The second protein , Pex14p , is a membrane protein located at the outer surface of the peroxisome ( Albertini et al. , 1997 ; Brocard et al. , 1997 ; Komori et al. , 1997 ; Fransen et al. , 1998 ) ."	[exLink]		p7		FALSE	fact	5189	5376	
44	s29	"Pex14p physically interacts with both receptors , Pex5p and Pex7p , as well as with the peroxisomal membrane proteins Pex13p and Pex17p ( Albertini et al. , 1997 ; Brocard et al. , 1997 ; Huhse et al. , 1998 ) ."	[exLink]		p7		FALSE	fact	5377	5578	
45	s30	"Together , these data suggest"	[]		p7		FALSE	implication	5579	5607	
46	s30	"that the two import pathways are not independent but overlapping , with Pex14p as the point of convergence of the pathways at the peroxisomal membrane ( Albertini et al. , 1997 ) ."	[exLink]		p7		FALSE	implication	5608	5783	
47	s31	We report	[]		p8		FALSE	implication	5784	5793	
48	s31	that Pex13p directly or indirectly interacts with the PTS2 receptor .	[]		p8		FALSE	implication	5794	5862	
49	s32	In	[]		p8		FALSE	none	5863	5865	
50	s32	"cells lacking Pex14p , Pex13p efficiently coimmunoprecipitates with Pex7p and interacts with Pex7p in the yeast two-hybrid system ."	[]		p8		FALSE	method	5866	5995	
51	s33	"In addition , overexpression of Pex13p suppresses the protein import defect caused by HA-tagged , functionally compromised Pex7p ,"	[]		p8		FALSE	result	5996	6123	
52	s33	further suggesting an interaction between the two proteins by genetic means .	[]		p8		FALSE	implication	6124	6200	
53	s34	Regions NH2-terminal of the COOH-terminal SH3 domain of Pex13p were required for its interaction with Pex7p .	[]		p8		FALSE	fact	6201	6309	
54	s35	Reinvestigation of the membrane topology of Pex13p revealed	[]		p8		FALSE	result	6310	6369	
55	s35	that both termini of the protein are exposed to the cytosol .	[]		p8		FALSE	result	6370	6430	
56	s36	Pex13p was also required for Pex14p localization at the peroxisomal membrane .	[]		p8		FALSE	result	6431	6508	
57	s37	"However , the peroxisomal targeting of Pex14p did not require interaction with the SH3 domain of Pex13p ."	[]		p8		FALSE	result	6509	6612	
58	s38	Materials and Methods	[header-0]		title9	Materials and Methods	FALSE	none	6613	6634	
59	s39	Strains and Culture Conditions	[header-1]		title10	Materials and Methods	FALSE	none	6635	6665	
60	s40	S. cerevisiae strains used in this study are listed in	[]		p11	Materials and Methods	FALSE	method	6666	6720	
61	s40	Table I .	[]		p11	Materials and Methods	FALSE	none	6721	6729	
62	s41	"Yeast complete ( YPD ) and minimal media ( SD ) have been described previously ( Erdmann et al. , 1989 ) ."	[exLink]		p11	Materials and Methods	FALSE	result	6730	6828	
63	s42	"YNO medium contained 0.1 % oleic acid , 0.05 % Tween 40 , 0.1 % yeast extract , and 0.67 % yeast nitrogen base without amino acids , adjusted to pH 6.0 ."	[]		p11	Materials and Methods	FALSE	method	6829	6973	
64	s43	When necessary	[]		p11	Materials and Methods	FALSE	method	6974	6988	
65	s43	auxotrophic requirements were added according to Ausubel et al. ( 1992 ) .	[exLink]		p11	Materials and Methods	FALSE	method	6989	7061	
66	s44	For induction of the CUP1 promoter CuSO4 was added according to Marzioch et al. ( 1994 ) .	[exLink]		p11	Materials and Methods	FALSE	method	7062	7149	
67	s45	Plasmids	[header-1]		title12	Materials and Methods	FALSE	none	7150	7158	
68	s46	"For construction of pRS-PEX7HA3 , the SacI/KpnI fragment of YIp-PEB - HA3 ( Zhang and Lazarow , 1995 ) was subcloned into low copy plasmid pRS316 ( Sikorski and Hieter , 1989 ) ."	[exLink]		p13	Materials and Methods	FALSE	method	7159	7328	
69	s47	YEp351-PEX14 was constructed by	[]		p13	Materials and Methods	FALSE	method	7329	7360	
70	s47	"subcloning the SacI/BamHI fragment of pRS-PEX14 into YEp351 ( Hill et al. , 1986 ; Albertini et al. , 1997 ) ."	[exLink]		p13	Materials and Methods	FALSE	method	7361	7465	
71	s48	YEp351-PEX13 was constructed by	[]		p13	Materials and Methods	FALSE	method	7466	7497	
72	s48	"subcloning the XhoI/PstI fragment of pRS-PEX13 into YEp351 ( Erdmann and Blobel , 1996 ) ."	[exLink]		p13	Materials and Methods	FALSE	method	7498	7584	
73	s49	"For construction of Pex14pAXXA and Pex13pE320K , mutations were introduced by PCR"	[]		p14	Materials and Methods	FALSE	method	7585	7665	
74	s49	"using gene splicing by overlap extension ( Yon and Fried , 1989 ) ."	[exLink]		p14	Materials and Methods	FALSE	method	7666	7729	
75	s50	Primers used	[]		p14	Materials and Methods	FALSE	method	7730	7742	
76	s50	"to construct Pex14pAXXA were : KU107 , 5'- ( GGAATTCGAGGCCTTATGAGTGACGTGGTCAGT ) -3 ' , ( nucleotides [ nt ] 1-18 ) ; RE9 , 5'- ( ATCCCTGTGGGCCAGCGTTGCTGGCATCGC ) -3 ' , ( nt 249-278 ; underlined nt represent introduced mutations ) ; RE8 , 5'- ( GCGATGCCAGCAACGCTGGCCCACAGGGAT ) -3 ' , ( nt 249-278 ) ; and KU109 , 5'- ( GGGGATCCCGGGATACCTATGGGATGGAGTCTTC ) -3 ' , ( nt 1016-1026 ) ."	[]		p14	Materials and Methods	FALSE	method	7743	8082	
77	s51	"pRS-PEX14 ( Albertini et al. , 1997 ) served as template ."	[exLink]		p14	Materials and Methods	FALSE	method	8083	8137	
78	s52	Primers used	[]		p14	Materials and Methods	FALSE	method	8138	8150	
79	s52	"to construct Pex13p-E320K were T3 , 5'- ( AATTAACCCTCACTAAAGGG ) -3 ' ; RE51 , 5'- ( CTCTGGGTTTTTTGGAACAAAATC ) -3 ' , ( nt 946-969 ) ; RE50 , 5'- ( GATTTTGTTCCAAAAAACCCAGAG ) -3 ' , ( nt 946-969 ) ; and T7 , 5'- ( GTAATACGACTCACTATAGGGC ) ."	[]		p14	Materials and Methods	FALSE	method	8151	8360	
80	s53	"pRS-PEX13 ( Erdmann and Blobel , 1996 ) served as template ."	[exLink]		p14	Materials and Methods	FALSE	method	8361	8417	
81	s54	The PEX14-PCR product was digested with EcoRI/ BamHI and subcloned into pBluescript SK ( + ) ( Stratagene )	[]		p14	Materials and Methods	FALSE	method	8418	8520	
82	s54	resulting in plasmid pWG14/4 .	[]		p14	Materials and Methods	FALSE	method	8521	8550	
83	s55	The PEX13-PCR product was digested with XhoI/PstI and subcloned into pBluescript SK ( + ) resulting in plasmid pWG13/13 .	[]		p14	Materials and Methods	FALSE	method	8551	8668	
84	s56	"For complementation studies , pRS-PEX14 ( Albertini et al. , 1997 ) was digested with HpaI/HindIII and"	[exLink]		p15	Materials and Methods	FALSE	method	8669	8767	
85	s56	the internal fragment of PEX14 ( nt 123-702 ) was exchanged by a HpaI/HindIII fragment of PEX14AXXA from plasmid pWG14/4 .	[]		p15	Materials and Methods	FALSE	method	8768	8887	
86	s57	The resulting plasmid pWG14/9 contained the PEX14AXXA-ORF as well as 601 bp of the 5 ' - and 628 bp of the 3'-noncoding region of PEX14 .	[]		p15	Materials and Methods	FALSE	fact	8888	9022	
87	s58	"For complementation studies of pex13Delta , the 1.9-kb XhoI/PstI fragment of pWG13/13 containing the PEX13E320K-ORF , as well as 356 bp 5 ' - and 381 bp 3'-noncoding region of PEX13 were subcloned in the yeast CEN-plasmid pRS351 ( Sikorski and Hieter , 1989 ) resulting in pWG13/15 ."	[exLink]		p15	Materials and Methods	FALSE	method	9023	9298	
88	s59	Two-Hybrid Assay	[header-1]		title16	Materials and Methods	FALSE	none	9299	9315	
89	s60	The two-hybrid assay was based on the method of Fields and Song ( 1989 ) .	[exLink]		p17	Materials and Methods	FALSE	method	9316	9387	
90	s61	"The ORFs of selected PEX genes were fused to the DNA-binding domain or transcription-activating domain of GAL4 in the vectors pPC86 and pPC97 ( Chevray and Nathans , 1992 ) ."	[exLink]		p17	Materials and Methods	FALSE	method	9388	9558	
91	s62	To construct the Gal4p- ( BD ) - Pex13p fusion	[]		p17	Materials and Methods	FALSE	goal	9559	9601	
92	s62	"the EcoRI/SpeI fragment of plasmid pSP43D ( Erdmann and Blobel , 1996 ) containing the complete ORF of PEX13 was subcloned into pPC86 resulting in pPC86-PEX13 ."	[exLink]		p17	Materials and Methods	FALSE	method	9602	9759	
93	s63	"To construct the Gal4p ( DB ) - Pex14pAXXA fusion , the 1.1-kb EcoRI/SacII fragment from pWG14/4 , containing the complete PEX14AXXA-ORF"	[]		p17	Materials and Methods	FALSE	goal	9760	9890	
94	s63	was subcloned into EcoRI/ SacII-digested pPC86 .	[]		p17	Materials and Methods	FALSE	method	9891	9938	
95	s64	The resulting plasmid was designated pWG14/6 .	[]		p17	Materials and Methods	FALSE	method	9939	9984	
96	s65	"The SalI/SacII of pWG14/6 contained PEX14AXXA and was subcloned into SalI/SacII digested pPC97 ,"	[]		p17	Materials and Methods	FALSE	method	9985	10080	
97	s65	resulting in plasmid pWG14/8 .	[]		p17	Materials and Methods	FALSE	method	10081	10110	
98	s66	"The PEX13E320K ORF was amplified from plasmid pWG13/13 by PCR ,"	[]		p18	Materials and Methods	FALSE	method	10111	10173	
99	s66	using oligonucleotides 43fus1 5'- ( GTGAATTCGGATCCATATGTCATCCACAGCAGTA ) -3 ' and the T7-primer ( see above ) .	[]		p18	Materials and Methods	FALSE	method	10174	10277	
100	s67	"The resulting PCR fragment was subcloned into a EcoRI/SpeI digested pPC86 ,"	[]		p18	Materials and Methods	FALSE	method	10278	10352	
101	s67	resulting in plasmid pWG13/18 .	[]		p18	Materials and Methods	FALSE	method	10353	10383	
102	s68	Amino acids 286-386 of Pex13pE320K were amplified by PCR	[]		p18	Materials and Methods	FALSE	method	10384	10440	
103	s68	"using primers 37hyb1 5'- ( TCCAGAATTCGGATCCTACAGACCTCTGGAACCATA ) -3 ' , T7 , and pWG13/13 as templates ."	[]		p18	Materials and Methods	FALSE	method	10441	10538	
104	s69	"The PCR product was subcloned with EcoRI/SpeI into pPC86 ,"	[]		p18	Materials and Methods	FALSE	method	10539	10596	
105	s69	resulting in plasmid pWG13/16 .	[]		p18	Materials and Methods	FALSE	method	10597	10627	
106	s70	"Subsequently , pWG13/16 was digested with SmaI/SpeI , and"	[]		p18	Materials and Methods	FALSE	method	10628	10683	
107	s70	"the excised PEX13E320K fragment was subcloned into SmaI/SpeI digested pPC97 , resulting in plasmid pWG13/19 ."	[]		p18	Materials and Methods	FALSE	method	10684	10791	
108	s71	"Constructions of the Gal4p-AD-Pex5p , Gal4p-DB-Pex7p , and Gal4p-AD-Pex14p fusion proteins have been described previously ( Erdmann and Blobel , 1996 ; Rehling et al. , 1996 ; Albertini et al. , 1997 ) ."	[exLink]		p19	Materials and Methods	FALSE	result	10792	10985	
109	s72	Cotransformation of two-hybrid vectors into the PCY2 and HF7c was performed according to Gietz and Sugino ( 1988 ) .	[exLink]		p19	Materials and Methods	FALSE	method	10986	11099	
110	s73	Double transformants were selected on SD synthetic medium without tryptophane and leucine .	[]		p19	Materials and Methods	FALSE	method	11100	11190	
111	s74	"beta-galactosidase activity of transformed cells was determined by a filter assay described by Rehling et al. ( 1996 ) ,"	[exLink]		p19	Materials and Methods	FALSE	method	11191	11308	
112	s74	using X-Gal ( GIBCO BRL ) as substrate .	[]		p19	Materials and Methods	FALSE	method	11309	11346	
113	s75	His auxotrophy of transformed HF7c was determined by growth on selective plates	[]		p19	Materials and Methods	FALSE	method	11347	11426	
114	s75	"lacking leucine , tryptophane , and histidine , but containing 10 mM 3-aminotriazole ."	[]		p19	Materials and Methods	FALSE	result	11427	11509	
115	s76	Construction of Knockout Strains	[header-1]		title20	Materials and Methods	FALSE	none	11510	11542	
116	s77	"To delete PEX5 , PEX13 , PEX14 , and PEX17 in the yeast two-hybrid reporter strains PCY2 and HF7c , as well as the deletion of PEX7 and PEX13 in wild-type UTL7A , PEX14 in pex17Delta , PEX17 in pex13Delta , and PEX5 in pex14Delta"	[]		p21	Materials and Methods	FALSE	goal	11543	11765	
117	s77	"the kanMX4 gene was used as a selective marker for insertion into the genomic locus ( Wach et al. , 1994 ) ."	[exLink]		p21	Materials and Methods	FALSE	method	11766	11871	
118	s78	Deletion cassettes containing the kanMX4 gene and the 5 ' and 3 ' untranslated	[]		p21	Materials and Methods	FALSE	method	11872	11948	
119	s78	"regions of the corresponding ORFs were constructed by PCR using pFA6a-kanMX4 ( Wach et al. , 1994 ) as a template ."	[exLink]		p21	Materials and Methods	FALSE	method	11949	12060	
120	s79	"To generate the deletion cassettes for the PEX5 gene deletion , the primer sets KU301 , 5'- ( TATACATCAATAAACAATATATCATAACACATGGACGTACGTACGCTGCAG - GTGGAC ) -3 ' and KU302"	[]		p21	Materials and Methods	FALSE	goal	12061	12224	
121	s79	5'- ( TGATGCGAGAACATAAAATTGCGGAGAACCATATCAATCGATGAATTCGAGCTCG ) -3 ' were used .	[]		p21	Materials and Methods	FALSE	method	12225	12300	
122	s80	"For the PEX13 gene deletion , the primer sets KU274 , 5'- ( TATCTATAAATATCAAGGGGATTCTATACTATAACAATACCTGCGC-GTACGCTGCAGGTCGAC ) -3 ' and KU275 , 5'- ( TTTACTATATATATATGCGAATATATG TG TGCAAATATTGATGCAATCGATGA - ATTCGAGCTCG ) -3 ' were used ."	[]		p21	Materials and Methods	FALSE	method	12301	12524	
123	s81	"For the PEX7 gene deletion , KU371 , 5 ' - ( GTTAACGGAC TAT CATC TAAC TTTTTGCATAATTTATACAACATGCGTACGCTGCAGGTCGAC ) -3 ' and KU372 , 5'- ( GTTTAAATAATGCAAAAAATTTGTGTAAAAAGAATATGTGTCAACATC - GATGAATTCGAGCTCG ) -3 ' were used ."	[]		p21	Materials and Methods	FALSE	method	12525	12733	
124	s82	"For PEX14 gene deletion , the primer sets"	[]		p21	Materials and Methods	FALSE	goal	12734	12774	
125	s82	"KU289 , 5'- ( GAAAACTCAAGTAAAACAGAGAAGTTGTAAGGTGAATAAGGACGTACGCTGCAGGTCGAC ) -3 ' and KU290 , 5 ' - ( AATTACAATTTCCG TTAAAAAAC TAATTACTTACATAGAAATTGCGATCGATGAATTCGAGCTCG ) -3 ' were used ."	[]		p21	Materials and Methods	FALSE	method	12775	12949	
126	s83	"Finally , for a PEX17 gene deletion the primer sets KU251 , 5'- ( TCCATCATTCT GATAAGCAGAACCACG TAAGGCAGAC TAAAATCCG TAC-GCTGCAGGTCGAC ) -3 ' and KU273 , 5'- ( ACGTGCACTAGAGCGTTTTAAATTCAATGCTATTATTTTTGATTGATCGATGAATTCG - AGCTCG ) -3 ' were used ."	[]		p21	Materials and Methods	FALSE	method	12950	13180	
127	s84	"For construction of the double knockout strain pex5/14Delta , the PEX14 locus was replaced by the loxP-kanMX4-loxP cassette ( Guldener et al. , 1996 ) ."	[exLink]		p22	Materials and Methods	FALSE	method	13181	13328	
128	s85	"The PEX14 deletion cassette was constructed by PCR with the primer set KU289 , 5'- ( GAAAACTCAAGTAAAACAGAGAAGTTGTAAGGTGAATAAGGACGTACGCTGCAGGTCGAC ) -3 ' and RE24 , 5 ' - ( CAATTTCC GTTAAAAAAC TAATTAC TTACATAGAA TTGCGATAGGCCACTAGTGGATCTG ) -3 ' with plasmid pUG6 as template ( Guldener et al. , 1996 ) ."	[exLink]		p22	Materials and Methods	FALSE	method	13329	13614	
129	s86	"The loxP-kanMX4-loxP cassette was integrated into the PEX14 locus and excised afterwards by the CRE recombinase expressed from plasmid pSH47 ( Guldener et al. , 1996 ) ."	[exLink]		p23	Materials and Methods	FALSE	method	13615	13780	
130	s87	"Subsequently , PEX5 was deleted"	[]		p23	Materials and Methods	FALSE	method	13781	13811	
131	s87	as described above .	[]		p23	Materials and Methods	FALSE	method	13812	13831	
132	s88	PCRs and selection for geneticin resistance of transformants were performed according to Wach et al. ( 1994 ) .	[exLink]		p24	Materials and Methods	FALSE	method	13832	13940	
133	s89	Authenticity of each gene deletion by integration of the kanMX4 gene was confirmed by PCR .	[]		p24	Materials and Methods	FALSE	method	13941	14031	
134	s90	Cell Fractionation	[header-1]		title25	Materials and Methods	FALSE	none	14032	14050	
135	s91	"Spheroplasting of yeast cells , homogenization , and differential centrifugation at 25,000 g of homogenates were performed"	[]		p26	Materials and Methods	FALSE	method	14051	14171	
136	s91	"as described previously ( Erdmann et al. , 1989 ) ."	[exLink]		p26	Materials and Methods	FALSE	method	14172	14219	
137	s92	"For subfractionation by flotation gradient centrifugation , solid sucrose was added to a cell free extract , for a final concentration of 50 % ( wt/wt ) ."	[]		p27	Materials and Methods	FALSE	method	14220	14368	
138	s93	"7 ml of this extract was overlaid with 5 ml 46 % ( wt/wt ) , 15 ml 38 % ( wt/wt ) , and 3 ml"	[]		p27	Materials and Methods	FALSE	method	14369	14453	
139	s93	"25 % ( wt/wt ) sucrose in gradient buffer ( 5 mM MES , 1 mM EDTA , 1 mM KCl , 0.1 % [ vol/vol ] ethanol ) ."	[]		p27	Materials and Methods	FALSE	method	14454	14549	
140	s94	"Gradients were centrifuged in a Sorvall-SV288 rotor at 20,000 rpm for 4 h ."	[]		p27	Materials and Methods	FALSE	method	14550	14624	
141	s95	27 fractions were collected from the bottom and processed for enzyme measurement and Western blotting .	[]		p27	Materials and Methods	FALSE	method	14625	14727	
142	s96	Enzyme Assays	[header-1]		title28	Materials and Methods	FALSE	none	14728	14741	
143	s97	"3-oxoacyl-CoA thiolase ( EC 2.3.1.16 ) ,"	[]		p29	Materials and Methods	FALSE	none	14742	14779	
144	s98	"catalase ( EC 1.11.1.6 ) ,"	[]		p29	Materials and Methods	FALSE	none	14780	14803	
145	s99	"and fumarate hydratase ( fumarase : EC 4.2.1.2 ) were assayed according to published procedures ( Moreno de la Garza et al. , 1985 ; Veenhuis et al. , 1987 ) ."	[exLink]		p29	Materials and Methods	FALSE	method	14804	14954	
146	s100	Protease Protection Assay	[header-1]		title30	Materials and Methods	FALSE	none	14955	14980	
147	s101	The peroxisomal peak fractions of a sucrose density gradient were pooled and subsequently diluted	[]		p31	Materials and Methods	FALSE	method	14981	15078	
148	s101	"fivefold in gradient buffer ( Erdmann and Blobel , 1995 ) ."	[exLink]		p31	Materials and Methods	FALSE	method	15079	15134	
149	s102	"Peroxisomes were concentrated by centrifugation at 25,000 g for 30 min ."	[]		p31	Materials and Methods	FALSE	method	15135	15206	
150	s103	"The resultant pellet was resuspended in homogenization buffer ( Erdmann et al. , 1989 ) supplemented with 50 mM KCl , but without protease inhibitors ."	[exLink]		p31	Materials and Methods	FALSE	method	15207	15353	
151	s104	Equal amounts of isolated peroxisomes were incubated for 10 min on ice with increasing amounts of proteinase K .	[]		p31	Materials and Methods	FALSE	method	15354	15465	
152	s105	The proteinase was inhibited by the addition of 4 mM PMSF .	[]		p31	Materials and Methods	FALSE	result	15466	15524	
153	s106	The proteins were then precipitated with TCA	[]		p31	Materials and Methods	FALSE	method	15525	15569	
154	s106	and the samples were processed for SDS-PAGE .	[]		p31	Materials and Methods	FALSE	method	15570	15614	
155	s107	"Antibodies , Western Blotting , and Coimmunoprecipitation"	[header-1]		title32	Materials and Methods	FALSE	method	15615	15670	
156	s108	The protein fusion and purification system of New England Biolabs was used for overexpression of a maltose-binding protein-SH3 domain fusion protein ( MBP-SH3 ) .	[]		p33	Materials and Methods	FALSE	method	15671	15830	
157	s109	"Amino acids 286-386 of Pex13p comprising the SH3 domain of Pex13p were fused to the COOH terminus of the Escherichia coli MBP ( Erdmann and Blobel , 1996 ) ."	[exLink]		p33	Materials and Methods	FALSE	method	15831	15984	
158	s110	MBP-SH3 was expressed from pMAL-SH3 in E. coli strain TG1 .	[]		p33	Materials and Methods	FALSE	method	15985	16043	
159	s111	"The expression was induced with 0.3 mM isopropyl-beta-d-thiogalactopyranoside ( IPTG ) , and"	[]		p33	Materials and Methods	FALSE	method	16044	16133	
160	s111	affinity purification of the MBP-SH3 fusion protein on amylose resin was performed according to the manufacturer 's protocol .	[]		p33	Materials and Methods	FALSE	method	16134	16258	
161	s112	Polyclonal antibodies were raised against the fusion protein ( Eurogentec ) .	[]		p33	Materials and Methods	FALSE	method	16259	16333	
