	SentenceId	Clause Text	Codes	ExperimentValues	Paragraph	Headings	FloatingBox?	Discourse Type	Offset_Begin	Offset_End	fig_spans
0	s1	Mechanisms through which	[]		-		FALSE	none	148	172	
1	s1	Sos-1 coordinates the activation of Ras and Rac	[]		-		FALSE	none	173	220	
2	s2	Signaling from receptor tyrosine kinases ( RTKs ) *	[]		p4		FALSE	fact	964	1012	
3	s2	requires the sequential activation of the small GTPases Ras and Rac .	[]		p4		FALSE	fact	1013	1081	
4	s3	"Son of sevenless ( Sos-1 ) , a bifunctional guanine nucleotide exchange factor ( GEF ) , activates Ras in vivo and displays Rac-GEF activity in vitro ,"	[]		p4		FALSE	fact	1082	1226	
5	s3	"when engaged in a tricomplex with Eps8 and E3b1-Abi-1 , a RTK substrate and an adaptor protein , respectively ."	[]		p4		FALSE	fact	1227	1335	
6	s4	A mechanistic understanding of	[]		p4		FALSE	problem	1336	1366	
7	s4	"how Sos-1 coordinates Ras and Rac activity is , however , still missing ."	[]		p4		FALSE	problem	1367	1437	
8	s5	"Here , we demonstrate that ( a ) Sos-1 , E3b1 , and Eps8 assemble into a tricomplex in vivo under physiological conditions ; ( b ) Grb2 and E3b1 bind through their SH3 domains to the same binding site on Sos-1 , thus determining the formation of either a Sos-1-Grb2 ( S/G ) or a Sos-1-E3b1-Eps8 ( S/E/E8 ) complex , endowed with Ras - and Rac-specific GEF activities , respectively ; ( c ) the Sos-1-Grb2 complex is disrupted upon RTKs activation , whereas the S/E/E8 complex is not ; and ( d ) in keeping with the previous result , the activation of Ras by growth factors is short-lived , whereas the activation of Rac is sustained ."	[]		p4		FALSE	fact	1438	2046	
9	s6	"Thus , the involvement of Sos-1 at two distinct and differentially regulated steps of the signaling cascade allows for coordinated activation of Ras and Rac and different duration of their signaling within the cell ."	[]		p4		FALSE	implication	2047	2261	
10	s7	Introduction	[header-0]		title5	Introduction	FALSE	none	2290	2302	
11	s8	"A major mechanism of signal transduction by receptor tyrosine kinases ( RTKs ) * involves the activation of small GTPases , among"	[]		p6	Introduction	FALSE	fact	2303	2428	
12	s8	"which Ras and Rac are pivotal ( Scita et al. , 2000 ) ."	[exLink]		p6	Introduction	FALSE	fact	2429	2480	
13	s9	"There is evidence for hierarchical organization of small GTPases in signal transduction pathways ( Van Aelst and D'Souza-Schorey , 1997 ; Hall , 1998 ; Scita et al. , 2000 ) ."	[exLink]		p6	Introduction	FALSE	fact	2481	2648	
14	s10	"In addition , regulators of small GTPase activity , such as the guanine nucleotide exchange factor ( GEF ) son of sevenless ( Sos-1 ) , appear"	[]		p6	Introduction	FALSE	fact	2649	2784	
15	s10	"to control different events in the signaling cascade ( for review see Bar-Sagi and Hall , 2000 ; Schlessinger , 2000 ; Scita et al. , 2000 ) ."	[exLink]		p6	Introduction	FALSE	fact	2785	2919	
16	s11	A scenario can thus be envisioned in	[]		p6	Introduction	FALSE	hypothesis	2920	2956	
17	s11	which coordinated and/or sequential activation of small GTPases is achieved through the action of the same regulator at multiple steps .	[]		p6	Introduction	FALSE	hypothesis	2957	3092	
18	s12	"The molecular mechanisms involved , however , remain yet"	[]		p6	Introduction	FALSE	problem	3093	3147	
19	s12	to be understood .	[]		p6	Introduction	FALSE	problem	3148	3165	
20	s13	"Sos-1 is a well-known Ras-GEF ( for review see Bar-Sagi , 1994 ; Schlessinger , 2000 ) ,"	[exLink]		p6	Introduction	FALSE	fact	3166	3248	
21	s13	"whose specific catalytic activity is encoded by its Cdc25-like domain ( Bar-Sagi , 1994 ) ."	[exLink]		p6	Introduction	FALSE	fact	3249	3336	
22	s14	Elegant biochemical and genetic studies have clarified	[]		p6	Introduction	FALSE	method	3337	3391	
23	s14	"how the proline-rich COOH-terminal tail of Sos-1 interacts with the SH3-containing adaptor molecule Grb2 ( Bar-Sagi , 1994 ) ."	[exLink]		p6	Introduction	FALSE	implication	3392	3514	
24	s15	Grb2 in turn displays	[]		p6	Introduction	FALSE	fact	3515	3536	
25	s15	"a SH2 domain responsible for the recruitment of the Grb2-Sos-1 complex to active , autophosphorylated RTKs ( Lowenstein et al. , 1992 ; Ceresa and Pessin , 1998 ) ."	[exLink]		p6	Introduction	FALSE	fact	3537	3694	
26	s16	The relocalization of the complex to the plasma membrane is thought	[]		p6	Introduction	FALSE	hypothesis	3695	3762	
27	s16	"to be sufficient for Sos-1 to catalyze the exchange of guanine nucleotides on Ras , which is also present at the membrane , with ensuing activation of this small GTPase ."	[]		p6	Introduction	FALSE	hypothesis	3763	3930	
28	s17	"Active Ras ( Ras-GTP ) triggers a number of signaling cascades , among"	[]		p7	Introduction	FALSE	fact	3931	3998	
29	s17	"which is the one connecting Ras to Rac , a member of the Rho subfamily of small GTPases ."	[]		p7	Introduction	FALSE	fact	3999	4086	
30	s18	There is evidence	[]		p7	Introduction	FALSE	fact	4087	4104	
31	s18	that Sos-1 is also active at this step .	[]		p7	Introduction	FALSE	fact	4105	4144	
32	s19	"First , Sos-1 contains a Dbl homology domain in tandem with a Pleckstrin homology domain , a module responsible for GEF activity on Rho GTPases ( Cerione and Zheng , 1996 ; Nimnual et al. , 1998 ) ."	[exLink]		p7	Introduction	FALSE	fact	4145	4335	
33	s20	"Second , and most importantly , Sos-1 has been shown"	[]		p7	Introduction	FALSE	result	4336	4386	
34	s20	"to form a tricomplex in vivo with two signaling molecules , Eps8 ( Fazioli et al. , 1993 ) and E3b1 ( also known as Abi-1 ) ( Shi et al. , 1995 ; Biesova et al. , 1997 ) ."	[exLink]		p7	Introduction	FALSE	result	4387	4546	
35	s21	"E3b1 contains a SH3 domain and binds Sos-1 ( Scita et al. , 1999 ; Fan and Goff , 2000 ) ."	[exLink]		p7	Introduction	FALSE	result	4547	4631	
36	s22	"In addition , E3b1 binds to the SH3 domain of Eps8 ( Biesova et al. , 1997 ) ."	[exLink]		p7	Introduction	FALSE	result	4632	4705	
37	s23	"Thus E3b1 acts as a scaffold protein ,"	[]		p7	Introduction	FALSE	implication	4706	4743	
38	s23	which holds together Sos-1 and Eps8 .	[]		p7	Introduction	FALSE	implication	4744	4780	
39	s24	"The tricomplex Sos-1-E3b1-Eps8 ( S/E/E8 ) is endowed with Rac GEF activity in vitro ( Scita et al. , 1999 ) ."	[exLink]		p7	Introduction	FALSE	result	4781	4884	
40	s25	"Thus , the sum of the above observation raises the possibility"	[]		p7	Introduction	FALSE	implication	4885	4946	
41	s25	"that Sos-1 might function at different step in the signaling cascade , acting as a Ras-GEF and a Rac-GEF , respectively ."	[]		p7	Introduction	FALSE	implication	4947	5065	
42	s26	"A number of outstanding questions need clarification , however , before such a model could be accepted"	[]		p7	Introduction	FALSE	problem	5066	5166	
43	s26	does a trimeric S/E/E8 complex exist under physiological conditions ?	[]		p7	Introduction	FALSE	problem	5167	5236	
44	s27	How is the specificity of Sos-1 directed toward Ras or Rac ?	[]		p7	Introduction	FALSE	problem	5237	5296	
45	s28	Does the putative dual function of Sos-1 provide a mechanistic framework for the coordinated activation of Ras and Rac ?	[]		p7	Introduction	FALSE	problem	5297	5416	
46	s29	The present studies were undertaken	[]		p7	Introduction	FALSE	goal	5417	5452	
47	s29	to elucidate these questions .	[]		p7	Introduction	FALSE	goal	5453	5482	
48	s30	Results	[header-0]		title8	Results	FALSE	none	5483	5490	
49	s31	The S/E/E8 complex exists under physiological conditions	[header-1]		title9	Results	FALSE	fact	5491	5547	
50	s32	"In previous studies , we showed"	[]		p10	Results	FALSE	result	5548	5578	
51	s32	"that Sos-1 , E3b1 , and Eps8 could form a trimeric complex in vivo upon concomitant overexpression of the three proteins ."	[]		p10	Results	FALSE	implication	5579	5698	
52	s33	"However , we failed"	[]		p10	Results	FALSE	result	5699	5717	
53	s33	"to detect the existence of an endogenous S/E/E8 complex ( Scita et al. , 1999 ) ."	[exLink]		p10	Results	FALSE	result	5718	5795	
54	s34	We reasoned	[]		p10	Results	FALSE	hypothesis	5796	5807	
55	s34	that this could be due to the low efficiency of the immunoprecipitating antibodies used .	[]		p10	Results	FALSE	hypothesis	5808	5896	
56	s35	We thus sought	[]		p10	Results	FALSE	goal	5897	5911	1a
57	s35	to exploit the availability of eps8-/ - fibroblasts to circumvent this problem .	[]		p10	Results	FALSE	goal	5912	5990	1a
58	s36	"To this end , we performed immunoprecipitation experiments using eps8-/ - fibroblasts"	[]		p10	Results	FALSE	method	5991	6074	1a
59	s36	"in which the expression of Eps8 was restored , to physiological levels , with an expression vector encoding a myc epitope-tagged Eps8 ( -/ - [ Eps8myc ] cells ) ."	[]		p10	Results	FALSE	method	6075	6229	1a
60	s37	We selected transfected clones	[]		p10	Results	FALSE	method	6230	6260	1a
61	s37	in which the levels of expression of Eps8myc were very similar to those present in wild-type fibroblasts ( Fig. 1 A ) .	[inLink]	1a	p10	Results	FALSE	result	6261	6377	1a
62	s38	"Endogenous Sos-1 and E3b1 could be detected in anti-myc immunoprecipitates from lysates of Eps8myc-reconstituted , but not from eps8-/ - fibroblasts ( Fig. 1 B ) ."	[inLink]	1b	p10	Results	FALSE	result	6378	6536	1b
63	s50	"To determine whether E3b1 mediates the interaction between Eps8 and Sos-1 , as it would be expected according to the tricomplex model"	[]		p13	Results	FALSE	goal	8038	8170	1b
64	s50	we performed coimmunoprecipitation experiments under conditions in which the association between Eps8 and E3b1 was disrupted .	[]		p13	Results	FALSE	method	8171	8297	1b
65	s51	"The binding site of E3b1 to the SH3 domain of Eps8 was previously mapped to the amino acid sequence , PPPPPVDYTEDEE ,"	[]		p13	Results	FALSE	method	8298	8413	1b
66	s51	"where the D and the Y residues are critical for efficient binding ( Mongiovi et al. , 1999 ) ."	[exLink]		p13	Results	FALSE	fact	8414	8504	1b
67	s52	"Thus , a peptide encompassing this region should specifically disrupt the Eps8-E3b1 association ."	[]		p13	Results	FALSE	hypothesis	8505	8600	1b
68	s53	"Indeed , no E3b1could be recovered in anti-myc immunoprecipitates from lysates of Eps8myc-reconstituted cells ,"	[]		p13	Results	FALSE	result	8601	8710	1c|1b
69	s53	when the immunoprecipitation was performed in the presence of an excess of the competing peptide .	[]		p13	Results	FALSE	method	8711	8808	1c|1b
70	s54	"The association was , however , preserved"	[]		p13	Results	FALSE	result	8809	8848	1c
71	s54	"when a control peptide , bearing a Y -- > A substitution and unable to bind to Eps8 ( Mongiovi et al. , 1999 ) , was used ( Fig. 1 C ) ."	"[inLink, exLink]"	1c	p13	Results	FALSE	result	8849	8974	1c
72	s55	"Similarly , no Sos-1 could be recovered in anti-myc immunoprecipitates in the presence of the competing , but not of the control , peptide ( Fig. 1 C ) ."	[inLink]	1c	p13	Results	FALSE	result	8975	9122	1c
73	s56	"Thus , under physiological conditions , the coimmunoprecipitation of Eps8 and Sos-1 depends on the integrity of the Eps8-E3b1 interaction ,"	[]		p13	Results	FALSE	implication	9123	9259	1c
74	s56	pointing to the existence of a physiological S/E/E8 complex .	[]		p13	Results	FALSE	implication	9260	9320	1c
75	s57	It can not be formally excluded	[]		p13	Results	FALSE	hypothesis	9321	9351	1c
76	s57	"that Eps8 , E3b1 , and Sos-1 associate after cell lysis , thus allowing coimmunoprecipitation ."	[]		p13	Results	FALSE	hypothesis	9352	9443	1c
77	s58	"However , we have previously demonstrated ( Scita et al. , 2001 )"	[exLink]		p13	Results	FALSE	result	9444	9505	
78	s58	that the three endogenous proteins also colocalize in vivo in dynamic actin structures .	[]		p13	Results	FALSE	result	9506	9593	
79	s59	"Thus , the sum of our results strongly argues in favor of the existence of a physiological S/E/E8 complex ."	[]		p13	Results	FALSE	implication	9594	9699	
80	s60	"Similarly , it can not be formally excluded"	[]		p14	Results	FALSE	hypothesis	9700	9741	
81	s60	"that other interactors of the SH3 domain of Eps8 , besides E3b1 , mediate the formation of the endogenous trimeric complex ."	[]		p14	Results	FALSE	implication	9742	9863	
82	s61	"This is , however , unlikely"	[]		p14	Results	FALSE	implication	9864	9890	
83	s61	"since no coimmunoprecipitation between Eps8 and Sos-1 could be detected when the two proteins were overexpressed in cell lines with relative low levels of E3b1 ( Scita et al. , 1999 ; unpublished data ) ."	[exLink]		p14	Results	FALSE	result	9891	10090	
84	s62	"Moreover , neither RN-tre , nor"	[]		p14	Results	FALSE	result	10091	10120	
85	s62	"JIK , two other known interactors of the SH3 domain of Eps8 ( Biesova et al. , 1997 ; Mongiovi et al. , 1999 ) , were able to bind to Sos-1 ( unpublished data ) ."	[exLink]		p14	Results	FALSE	result	10121	10273	
86	s63	"The adaptor molecules , E3b1 and Grb2 , compete for binding to Sos-1 both in vitro and in vivo"	[header-1]		title15	Results	FALSE	result	10274	10366	2a
87	s64	Sos-1 has been shown	[]		p16	Results	FALSE	result	10367	10387	2a
88	s64	"to be part of a signaling complex with Grb2 , which mediates the activation of Ras upon RTK stimulation ."	[]		p16	Results	FALSE	result	10388	10491	2a
89	s65	Our finding	[]		p16	Results	FALSE	implication	10492	10503	2a
90	s65	"that , under physiological conditions , Sos-1 also participates in a complex with Eps8 and E3b1 raises the question of the physical and functional relationships between these two Sos-1-containing complexes ."	[]		p16	Results	FALSE	implication	10504	10708	2a
91	s66	"To gain insight into this issue , we initially mapped the region of E3b1 responsible for the interaction with Sos-1 by"	[]		p16	Results	FALSE	goal	10709	10826	2a
92	s66	using a series of deletion mutants of E3b1 fused to glutathione S-transferase ( GST ) .	[]		p16	Results	FALSE	method	10827	10911	2a
93	s67	Native Sos-1 could be efficiently	[]		p16	Results	FALSE	result	10912	10945	2a
94	s67	"recovered onto GST-E3b1 full length ( Fig. 2 A , amino acids [ aa ] 2-480 ) ."	[inLink]	2a	p16	Results	FALSE	result	10946	11017	2a
95	s68	Further mapping revealed	[]		p16	Results	FALSE	result	11018	11042	2a
96	s68	that the SH3 domain of E3b1 ( aa 416-480 ) was necessary and sufficient for binding ( Fig. 2 A ) .	[inLink]	2a	p16	Results	FALSE	result	11043	11136	2a
97	s88	We have previously shown	[]		p19	Results	FALSE	result	13079	13103	
98	s88	"that E3b1 binds to the proline-rich , COOH-terminal tail of Sos-1 ( aa 1131-1333 ) ( Scita et al. , 1999 ) , which also binds to the SH3 of Grb2 ( Li et al. , 1993 ; Cussac et al. , 1994 ) ."	[exLink]		p19	Results	FALSE	result	13104	13281	
99	s89	"Thus , Grb2 and E3b1 might compete for binding to Sos-1 ."	[]		p19	Results	FALSE	hypothesis	13282	13337	
100	s90	This hypothesis was validated by a series of experiments performed both in vitro and in vivo .	[]		p19	Results	FALSE	method	13338	13431	2d|3b|3a|2b|2c
101	s91	"We could demonstrate that ( a ) the SH3 of Grb2 , but not of Eps8 , efficiently competed with the SH3 of E3b1 for binding to the proline-rich COOH-terminal tail of Sos-1 in vitro ( Fig. 2 B ) ."	"[inLink, exLink]"	2b	p19	Results	FALSE	result	13432	14225	2d|3b|3a|2b|2c
101a	s91a	" ( b ) the Sos-1 peptide VPVPPPVPPRRR , known to constitute a Grb2-SH3 binding site ( Li et al. , 1993 ; Cussac et al. , 1994 ) , competed equally well the binding of the COOH-terminal tail of Sos-1 to the SH3s of Grb2 or E3b1 ( Fig. 2 C ) ."	"[inLink, exLink]"	2c	p19	Results	FALSE	result	13432	14225	2d|3b|3a|2b|2c
101b	s91b	( c ) the binding constants of the interaction between the proline rich COOH-terminal tail of Sos-1 and the SH3 domains of Grb2 and E3b1 were very similar ( Fig. 2 D ) .	"[inLink, exLink]"	2d	p19	Results	FALSE	result	13432	14225	2d|3b|3a|2b|2c
101c	s91c	( d ) overexpression of Grb2 abolished the ability of GST-E3b1 to bind to native Sos-1 ( Fig. 3 A ) .	"[inLink, exLink]"	3a	p19	Results	FALSE	result	13432	14225	2d|3b|3a|2b|2c
101d	s91d	 ( e ) overexpression of E3b1 significantly decreased the coimmunoprecipitation between Grb2 and Sos-1 ( Fig. 3 B ) .	"[inLink, exLink]"	3b	p19	Results	FALSE	result	13432	14225	2d|3b|3a|2b|2c
102	s92	"Thus , Sos-1 binds either E3b1 or Grb2 , in a mutually exclusive fashion ,"	[]		p19	Results	FALSE	result	14226	14297	2d|3b|3a|2b|2c
103	s92	suggesting that two distinct pools of Sos-1 exist in the cells .	[]		p19	Results	FALSE	implication	14298	14361	2d|3b|3a|2b|2c
104	s100	"To test this possibility in vivo , we set out"	[]		p22	Results	FALSE	goal	14976	15020	
105	s100	"to perturb the equilibrium between the Sos-1-E3b1 ( S/E ) and Sos-1-Grb2 ( S/G ) complexes , by increasing the levels of E3b1 within the cell ."	[]		p22	Results	FALSE	method	15021	15158	
106	s101	"If the two complexes are functionally distinct ,"	[]		p22	Results	FALSE	hypothesis	15159	15206	
107	s101	"then the overexpression of E3b1 , by competing the S/G interaction , should result in ( a ) reduced Sos-1 recruitment in vivo to active EGFR , ( b ) consequent reduction in Ras activation , as measured by reduced Ras-GTP levels , ( c ) reduced activation of Ras-dependent pathways , as measured by activation of MAPK , and finally ( d ) reduced proliferative response ."	[]		p22	Results	FALSE	hypothesis	15207	15560	
108	s102	"All of these predictions were confirmed experimentally ( Fig. 4 , A-C ) ."	[inLink]	4a|4b|4c	p22	Results	FALSE	result	15561	15630	4b|4c|4a
109	s119	We note	[]		p25	Results	FALSE	implication	17403	17410	
110	s119	"that our mapping data are at variance with those recently reported by Fan and Goff ( 2000 ) , who concluded that , in vivo , the interaction between Sos-1 and E3b1-Abi-1 is mediated by the NH2-terminal portion of the latter ."	[exLink]		p25	Results	FALSE	implication	17411	17630	
111	s120	"Consistently , Fan and Goff ( 2000 ) did not observe competition in vivo between Grb2 and E3b1 for binding to Sos-1 ."	[exLink]		p25	Results	FALSE	result	17631	17744	
112	s121	"Although we can not exclude that the NH2-terminal region of E3b1-Abi-1 participates in binding , in vivo , we were not able"	[]		p25	Results	FALSE	implication	17745	17865	2a
113	s121	"to observe a high-affinity binding surface in that region by in vitro binding experiments ( Fig. 2 A ; Scita et al. , 1999 ) ."	"[inLink, exLink]"	2a	p25	Results	FALSE	result	17866	17987	2a
114	s122	"Conversely , under our conditions of analysis , the efficient competition of the SH3 domains of Grb2 and E3b1 for binding to the same Sos-1 peptide , coupled to the readily detectable biological competition , strongly suggests"	[]		p25	Results	FALSE	result	17988	18210	2a
115	s122	that the SH3-mediated contact is the major determinant of the interaction between Sos-1 and E3b1 .	[]		p25	Results	FALSE	implication	18211	18308	2a
116	s123	E3b1 is a limiting factor in Rac activation	[header-1]		title26	Results	FALSE	implication	18309	18352	
117	s124	The competition between E3b1 and Grb2 for the same binding site on Sos-1 implies	[]		p27	Results	FALSE	implication	18353	18433	
118	s124	that an individual Sos-1 molecule can only be part of one GEF complex at a time .	[]		p27	Results	FALSE	implication	18434	18514	
119	s125	"However , different pools of Sos-1 , either bound to Grb2 or to E3b1 , could exist in vivo ."	[]		p27	Results	FALSE	hypothesis	18515	18603	
120	s126	We tried	[]		p27	Results	FALSE	goal	18604	18612	2d
121	s126	to gain insight into this issue .	[]		p27	Results	FALSE	goal	18613	18645	2d
122	s127	We showed	[]		p27	Results	FALSE	result	18646	18655	2d
123	s127	that BIAcore measurements revealed similar kinetic parameters for the SH3-mediated S/G and S/E interactions ( Fig. 2 D ) .	[inLink]	2d	p27	Results	FALSE	result	18656	18775	2d
124	s128	"However , when we measured the relative abundance of S/G and S/E complexes within the cell , we found a 10-fold excess of the former ( Fig. 5 A ) , under conditions"	[inLink]	5a	p27	Results	FALSE	result	18776	18935	5a
125	s128	"in which quantitative immunoprecipitation of the adaptor molecules , Grb2 and E3b1 , was achieved ( Fig. 5 A ) ."	[inLink]	5a	p27	Results	FALSE	result	18936	19043	5a
126	s129	"Thus , the data indicate"	[]		p27	Results	FALSE	implication	19044	19067	5b
127	s129	"that two pools of Sos-1 , associated with different adaptors , exist simultaneously in the cell ."	[]		p27	Results	FALSE	implication	19068	19162	5b
128	s130	They further suggest	[]		p27	Results	FALSE	implication	19163	19183	5b
129	s130	"that the pool of E3b1 , available for binding to Sos-1 , is reduced relative to that of Grb2 , and may be rate-limiting ."	[]		p27	Results	FALSE	implication	19184	19301	5b
130	s131	"Indeed , overexpression of E3b1 resulted in increased PAK65 activity , an indicator of Rac activation ( Manser et al. , 1994 ) ( Fig. 5 B ) ,"	"[inLink, exLink]"	5b	p27	Results	FALSE	result	19302	19435	5b
131	s131	which was abrogated by a dominant negative Rac mutant ( Fig. 5 B ) .	[inLink]	5b	p27	Results	FALSE	result	19436	19501	5b
132	s132	"On the other hand , overexpression of Sos-1 did not lead to increased PAK65 activity ."	[]		p27	Results	FALSE	result	19502	19586	5b
133	s133	An additional corollary of this hypothesis is	[]		p27	Results	FALSE	hypothesis	19587	19632	5b
134	s133	"that the overexpression of E3b1 , by facilitating the formation of a trimeric complex with Eps8 and Sos-1 , should directly lead to activation of Rac ."	[]		p27	Results	FALSE	hypothesis	19633	19781	5b
135	s134	"To test this prediction E3b1 or a mutant of E3b1 ( E3b1-DY ) ,"	[]		p27	Results	FALSE	goal	19782	19841	5b
136	s134	"bearing alanine substitutions of the DY residues critical for the interaction with Eps8 ( Mongiovi et al. , 1999 ) , were used to infect wild-type and eps8-/ - fibroblasts ."	[exLink]		p27	Results	FALSE	method	19842	20009	5b
137	s135	"The levels of GTP-bound Rac were then determined by in vitro binding assays using the immobilized CRIB domain of PAK65 ( Manser et al. , 1994 ) ."	[exLink]		p27	Results	FALSE	method	20010	20151	5b
138	s136	"E3b1 , but not the E3b1 mutant impaired in Eps8 binding , caused a readily detectable increase in Rac-GTP levels in wild type , but not in eps8-/ - fibroblasts ( Fig. 5 C ) ."	[inLink]	5c	p27	Results	FALSE	result	20152	20319	5c
139	s137	"Thus ,"	[]		p27	Results	FALSE	implication	20320	20325	5c
140	s137	the overexpression of E3b1 is sufficient to activate Rac and this effect is strictly dependent on Eps8 .	[]		p27	Results	FALSE	implication	20326	20429	5c
141	s152	The indispensability of E3b1 in the cascade of events leading	[]		p30	Results	FALSE	goal	22077	22138	
142	s152	to Rac activation and Rac-dependent actin reorganization was further analyzed at the biological level .	[]		p30	Results	FALSE	goal	22139	22241	
143	s153	"We have previously shown that interference with E3b1 functions , by microinjection of anti-E3b1 antibodies , inhibited PDGF-induced ruffles ( Scita et al. 1999 ) ."	[exLink]		p30	Results	FALSE	result	22242	22400	
144	s154	We also showed that in eps8-/ -	[]		p30	Results	FALSE	result	22401	22431	
145	s154	"cells , ruffling induced by PDGF and activated Ras , but not by activated Rac , was inhibited ."	[]		p30	Results	FALSE	result	22432	22523	
146	s155	"Ruffling , however , could be restored upon reexpression of Eps8 , but not of an Eps8 mutant unable to bind to E3b1 ( Scita et al. , 1999 ) , suggesting"	[exLink]		p30	Results	FALSE	result	22524	22669	
147	s155	that the Eps8-E3b1-based complex is implicated in the transmission of signal between Ras and Rac .	[]		p30	Results	FALSE	implication	22670	22767	
148	s156	"Thus , one might predict"	[]		p30	Results	FALSE	hypothesis	22768	22791	
149	s156	that a mutant of E3b1 unable to associate to Eps8 should function as a dominant negative on Ras-induced Rac-dependent ruffling .	[]		p30	Results	FALSE	hypothesis	22792	22919	
150	s157	To test this	[]		p30	Results	FALSE	goal	22920	22932	6
151	s157	"we cotransfected the activated versions of either Ras or Rac , together with E3b1 or the E3b1DY mutant ."	[]		p30	Results	FALSE	method	22933	23036	6
152	s158	"RasV12-induced , but not RacQL-induced , ruffles were efficiently inhibited by the coexpression of E3b1DY , but not of E3b1 wild type ( Fig. 6 ) , supporting the contention"	[inLink]	6	p30	Results	FALSE	result	23037	23203	6
153	s158	that the ability of E3b1 to form a complex with Eps8 is required to transmit signals from Ras to Rac .	[]		p30	Results	FALSE	implication	23204	23305	6
154	s159	"In conclusion , our data show"	[]		p30	Results	FALSE	implication	23306	23334	6
155	s159	"that two pools of Sos-1 exist in the cell , coupled respectively to Grb2 or E3b1 ."	[]		p30	Results	FALSE	implication	23335	23415	6
156	s160	"In addition , the availability of E3b1 , but not of Sos-1 , is indispensable and rate limiting in the pathway leading to Rac activation ."	[]		p30	Results	FALSE	implication	23416	23549	6
157	s169	The dual GEF activity of Sos-1 depends on its presence in distinct complexes	[header-1]		title33	Results	FALSE	implication	24578	24654	
158	s170	The existence of Sos-1 in two physically and functionally distinct pools suggests the hypothesis	[]		p34	Results	FALSE	hypothesis	24655	24751	
159	s170	"that its presence in a S/G or a S/E/E8 complex could dictate its Ras - or Rac-specific GEF activities , respectively ."	[]		p34	Results	FALSE	hypothesis	24752	24867	
160	s171	"To explore this possibility , we used an in vitro assay"	[]		p34	Results	FALSE	goal	24868	24922	7b|7a
161	s171	that can score GEF activities in Sos-1-containing immunoprecipitates .	[]		p34	Results	FALSE	method	24923	24992	7b|7a
162	s172	Cells were transfected with either Sos-1 alone ( SosTfx ) or a combination of S/E/E8 ( Triple Tfx ) ( Fig. 7 A ) .	[inLink]	7a	p34	Results	FALSE	method	24993	25100	7b|7a
163	s173	When Sos-1 was immunoprecipitated from SosTfx	[]		p34	Results	FALSE	method	25101	25146	7b|7a
